Item,Category,Price,ImagenURL
Aspiradora Robot Electrolux PURE I9 Gris PI92-4SGM,Aspiradoras,$690.00,https://timecenter.ec/wp-content/uploads/2021/01/PI92-4SGM-300x300.jpg
Máquina de Coser Breli BRL1978 Overlock y Recubridora,Máquina de Coser,$558.00$585.00,https://timecenter.ec/wp-content/uploads/2021/03/BRL1978-1-300x300.jpg
Aspiradora Electrolux  Inalámbrica Recargable Vertical PURE F9 SH1F9,Aspiradoras,$425.00,https://timecenter.ec/wp-content/uploads/2020/06/SH1F9-300x300.jpg
"Máquina De Coser Breli, Recubridora, 2,3 O 4 Hilos Taiwan BRL1970",Máquina de Coser,$388.00$399.00,https://timecenter.ec/wp-content/uploads/2020/01/BR1970-RECUBRIDORA-b-300x300.jpg
Máquina De Coser Singer Overlock 14SH754,Máquina de Coser,$379.00,https://timecenter.ec/wp-content/uploads/2021/08/Maquina-De-Coser-Singer-1-300x300.jpg
Aire Acondicionado Electrolux Eap12a3tscrw,Aire Acondicionado,$368.99$385.00,https://timecenter.ec/wp-content/uploads/2020/02/Aire-Acondicionado-EAP10A3TBNW-300x300.jpg
"Campana Extractora Electrolux de pared tipo península 90cm, EJWB369TDIS",Cocina,$349.00,https://timecenter.ec/wp-content/uploads/2021/02/Campana-EJSE306TBLS-w-300x300.jpg
Máquina De Coser Singer Heavy Duty 4423 Semi industrial 22puntadas,Máquina de Coser,$320.00,https://timecenter.ec/wp-content/uploads/2021/08/Maquina-De-Coser-heavy-duty-300x300.jpg
Impresora Todo en Uno HP Smart Tank 530 inalámbrica Tinta Continua,Impresoras,$320.00,https://timecenter.ec/wp-content/uploads/2021/04/HP-47-300x300.jpg
"Máquina De Coser Breli Recta Zig Zag Profesional 197 Puntada, BE2012",Máquina de Coser,$320.00$382.00,https://timecenter.ec/wp-content/uploads/2020/01/BE2012b-300x300.jpg
Horno Eléctrico Electrolux EOEC24M2CMSM Con Sistema De Convención A 220V,Cocina,$319.99,https://timecenter.ec/wp-content/uploads/2020/07/EOEC24M-300x300.jpg
"Máquina De Coser Breli, Overlock Con 3 o 4 Hilos",Máquina de Coser,$315.65$332.00,https://timecenter.ec/wp-content/uploads/2020/01/BRL2008-OVERLOCK-a-300x300.jpg
"Máquina De Coser Singer Electrónica, 80 Puntadas 6680",Máquina de Coser,$299.99,https://timecenter.ec/wp-content/uploads/2019/08/25-300x300.png
Horno Electrolux Empotrable Oed24m2cmsm Eléctrico 66 Lt,Cocina,$299.90,https://timecenter.ec/wp-content/uploads/2020/07/EOED24M2CMSM-300x300.jpg
Kit 4 cámaras de video vigilancia + Mini DVR  Hikvision,Cámaras,$299.00,https://timecenter.ec/wp-content/uploads/2021/03/134-2-3-1-300x300.jpg
Máquina De Coser Breli Resta Zig Zag Profesional 100 Puntada BE1000,Máquina de Coser,$293.00$325.00,https://timecenter.ec/wp-content/uploads/2020/01/BE1000-b-300x300.jpg
Impresora Inalámbrica HP Neverstop Laser 1000w Recargable,Impresoras,$279.00,https://timecenter.ec/wp-content/uploads/2021/02/HP-47-300x300.jpg
Licuadora Oster Xpert Pro BLSTVB-RV0-013 Pro jarra Tritan,"Cocina, Hogar",$259.00,https://timecenter.ec/wp-content/uploads/2020/12/PLANTILLA-17-300x300.jpg
Aspiradora Ergorápido Well Q6 Animal Electrolux ERG36,Aspiradoras,$258.00,https://timecenter.ec/wp-content/uploads/2021/08/ASPIRADORA-4-300x300.jpg
Reloj Casio Digital Triple Sensor Para Hombre Prg-110-1v,"Casio Digital, Relojería, Relojes",$250.00,https://timecenter.ec/wp-content/uploads/2019/06/781-1-300x300.png
Minibar Electrolux Ertm87g3hrs 87 Litros 2 Puertas,Cocina,$245.00$279.00,https://timecenter.ec/wp-content/uploads/2020/07/ERTM87G3HRS-300x300.jpg
Calculadora Casio Gráfica Fx-cg50,Calculadora,$238.00,https://timecenter.ec/wp-content/uploads/2018/01/Calculadora-Casio-FX-CG50-300x300.jpg
Juego De Cubiertos Oster 65 Piezas T-36030,"Cocina, Hogar",$225.00,https://timecenter.ec/wp-content/uploads/2019/09/22-300x300.jpg
Impresora Hp Multifunción 415 Ink Tank Tinta Continua Wifi,Impresoras,$224.99$268.00,https://timecenter.ec/wp-content/uploads/2021/04/HP-1-1-300x300.jpg
Aspiradora Electrolux New Ergorapido ERG26,"Aspiradoras, Hogar",$209.99,https://timecenter.ec/wp-content/uploads/2020/06/ERG26-300x300.jpg
Cepillo BaBylissPRO con tratamiento The Cold Brush Cryo Care,Cepillos,$198.99,https://timecenter.ec/wp-content/uploads/2021/03/CRIO-TERAPIA-1-300x300.jpg
Maquina Cortadora Profesional Wahl Bravura Para Mascota Inalámbrica 41870-0425,Máquinas Para Mascota,$198.99,https://timecenter.ec/wp-content/uploads/2019/12/134-300x300.jpg
"Máquina De Coser Singer 2263, 23 Puntadas",Máquina de Coser,$195.00,https://timecenter.ec/wp-content/uploads/2019/08/FGDS-300x300.jpg
Reloj D’mario Analógico Para Hombre ZE3180,"Otras Marcas, Relojería, Relojes",$195.00,https://timecenter.ec/wp-content/uploads/2019/05/ZE3180-300x300.jpg
"Máquina De Coser Breli Recta Zig Zag Profesional BR3200, 29 puntadas",Máquina de Coser,$190.00$210.00,https://timecenter.ec/wp-content/uploads/2020/08/BR3200-300x300.jpg
Máquina De Coser Singer 23 Puntadas En Un Solo Paso 2273,Máquina de Coser,$188.00,https://timecenter.ec/wp-content/uploads/2019/08/MAQUINA-SINGER--300x300.jpg
Reloj Guess Analógico Para Hombre U0244g3,"Otras Marcas, Relojería, Relojes",$185.00,https://timecenter.ec/wp-content/uploads/2019/05/Reloj-Guess-U0244G3-300x300.jpg
Reloj D’Mario Analógico Para Hombre ZS0153,"Otras Marcas, Relojería, Relojes",$180.00,https://timecenter.ec/wp-content/uploads/2020/11/ZS0153-300x300.jpg
Aspiradora Electrolux Ergorápido Erg24n Inalámbrico 30minutos,Aspiradoras,$179.00,https://timecenter.ec/wp-content/uploads/2020/06/RELOJ-CASIO-AW-48HE-9AV-1-300x300.jpg
Secadora de Cabello Profesional Babyliss Rápido Ferrari BF7000,"Salud y Belleza, Secadoras de Cabello",$179.00,https://timecenter.ec/wp-content/uploads/2019/01/45-300x300.png
"Máquina De Coser Singer Promise 1412, 12 Puntadas",Máquina de Coser,$178.00,https://timecenter.ec/wp-content/uploads/2019/02/Maquina-Singer-300x300.jpg
Reloj D’Mario Analógico Para Hombre ZL3152,"Otras Marcas, Relojería, Relojes",$175.00,https://timecenter.ec/wp-content/uploads/2020/11/ZL5132-300x300.jpg
"Reloj Guess Analógico, Multifunción Para Hombre U0170g2","Otras Marcas, Relojería, Relojes",$175.00,https://timecenter.ec/wp-content/uploads/2019/05/RELOJ-GUESS-U0170G2-300x300.jpg
"Reloj Guess Analógico, Multifunción Para Hombre U0040g3","Otras Marcas, Relojería, Relojes",$175.00,https://timecenter.ec/wp-content/uploads/2019/05/Reloj-Guess-U0040G31-300x300.jpg
Cortadora De Cabello Babylisspro Inalámbrico Fx870S,Profesional,$172.00,https://timecenter.ec/wp-content/uploads/2021/03/CORTADORA-2-300x300.jpg
Secadora de Cabello Twinturbo 2800 Cold Matic Profesional,"Salud y Belleza, Secadoras de Cabello",$172.00,https://timecenter.ec/wp-content/uploads/2018/09/P-300x300.jpg
Cortadora De Cabello Babylisspro Inalámbrico Fx870rg,"Cortadoras de Cabello, Profesional, Salud y Belleza",$169.99,https://timecenter.ec/wp-content/uploads/2019/09/70-300x300.jpg
Cortadora De Cabello Babylisspro Inalámbrico Fx870g,"Cortadoras de Cabello, Profesional, Salud y Belleza",$169.99,https://timecenter.ec/wp-content/uploads/2019/09/69-300x300.jpg
Calculadora Casio Gráfica Fx-9860gii-sd,Calculadora,$169.99,https://timecenter.ec/wp-content/uploads/2018/01/fx-9860GIISD-1-300x300.jpg
Aspiradora Electrolux Silenciosa De 1200 W Cyc01,"Aspiradoras, Hogar",$168.00,https://timecenter.ec/wp-content/uploads/2019/11/15-300x300.jpg
Secadora De Cabello Profesional Italia Brava Babyliss Bfb1,"Salud y Belleza, Secadoras de Cabello",$168.00,https://timecenter.ec/wp-content/uploads/2019/05/9-4-300x300.png
Kit 4 cámaras de video vigilancia + Mini DVR  Hikvision,Cámaras,$166.00,https://timecenter.ec/wp-content/uploads/2021/03/CAMARAS--300x300.jpg
"Máquina De Coser Breli Recta Zig Zag Profesional, BR1700, 17 puntadas",Máquina de Coser,$166.00$178.00,https://timecenter.ec/wp-content/uploads/2020/08/BR1700-300x300.jpg
Secadora De Cabello Profesional Turbo Twin 2600 Italiana,"Salud y Belleza, Secadoras de Cabello",$166.00,https://timecenter.ec/wp-content/uploads/2018/07/Secadora-De-Cabello-Profesional-Turbo-Twin-2600-Italiana-300x300.png
Reloj Citizen Analógico Para Hombre Aw1260-50e,"Otras Marcas, Relojería, Relojes",$165.00,https://timecenter.ec/wp-content/uploads/2019/05/Reloj-Citizen-AW1260-50E-300x300.jpg
Reloj Fossil Analógico Para Hombre FS5552,"Fossil, Relojes",$165.00,https://timecenter.ec/wp-content/uploads/2019/05/Reloj-Fossil-Analógico-Para-Hombre-Fs5552-300x300.jpg
Máquina De Coser Singer modelo Tradición 2250,Máquina de Coser,$162.00,https://timecenter.ec/wp-content/uploads/2019/04/Maquina-De-Coser-Singer-modelo-Tradicion-1-300x300.jpg
Secadora de Cabello Babyliss Volare Profesional motor Ferrari bfv1,"Salud y Belleza, Secadoras de Cabello",$162.00,https://timecenter.ec/wp-content/uploads/2018/01/SECADORA-BABYLLISS-VOLTARE-V1-2000W-300x300.jpg
Disco Duro Externo Seagate Portable 4tb Stdr4000100,Memorias,$160.00,https://timecenter.ec/wp-content/uploads/2020/08/Disco-Duro-4TB-seagate-gris-300x300.jpg
"Reloj Guess Analógico, Multifunción Para Hombre U0192g1","Otras Marcas, Relojería, Relojes",$160.00,https://timecenter.ec/wp-content/uploads/2019/05/RELOJ-GUESS-U0192G1-300x300.jpg
Campana Extractora Electrolux 3 Velocidades 90 Cm Acero Inox,Cocina,$159.99,https://timecenter.ec/wp-content/uploads/2020/02/Campana-EJSE306TBLS-w-300x300.jpg
Rebanadora de Jamón ELITE CUISINE,Cocina,$158.00,https://timecenter.ec/wp-content/uploads/2021/05/13-300x300.jpg
"Máquina De Coser Breli Recta Zig Zag Profesional BR1100, 11 puntadas",Máquina de Coser,$158.00$168.00,https://timecenter.ec/wp-content/uploads/2020/08/BR1100-300x300.jpg
"Reloj Fossil Analógico, Multifunción Para Hombre CH2564","Fossil, Relojería, Relojes",$158.00,https://timecenter.ec/wp-content/uploads/2019/05/01-4-300x300.png
Reloj D’Mario Analógico Para Hombre ZF5116,"Otras Marcas, Relojería, Relojes",$155.00,https://timecenter.ec/wp-content/uploads/2020/11/ZF5116-300x300.jpg
Horno Microondas Prima 1000watts 34 Litros D10034AP-DM,Cocina,$155.00,https://timecenter.ec/wp-content/uploads/2020/08/Horno-Prima-300x300.jpg
"Reloj Casio G-Shock Digital, Analógico Para Hombre GA-110GW-7ADR","G-Shock, Relojería, Relojes",$155.00,https://timecenter.ec/wp-content/uploads/2019/02/CASIO-26-300x300.jpg
Calculadora Gráfica Casio FX-9860GII,Calculadora,$152.00,https://timecenter.ec/wp-content/uploads/2020/08/FX-9860GII-300x300.jpg
Dispensador De Agua Electrolux Eqs20c3musg Silver,"Dispensadores, Hogar",$149.99$193.00,https://timecenter.ec/wp-content/uploads/2020/02/Dispensador-de-Agua-EQS20C3MUSG-1-300x300.jpg
Máquina De Coser Singer M1505,"Hogar, Máquina de Coser",$149.00,https://timecenter.ec/wp-content/uploads/2020/07/m1505-300x300.jpg
"Máquina De Coser Singer modelo Start 1306, 6 Puntadas",Máquina de Coser,$149.00,https://timecenter.ec/wp-content/uploads/2018/09/Maquina-de-Coser-Sin-1306-1-300x300.jpg
"Reloj Casio G-shock Digital, Analógico Para Hombre GA-700PC-1A","G-Shock, Relojería, Relojes",$148.00,https://timecenter.ec/wp-content/uploads/2019/02/495-300x300.png
Reloj Citizen para Hombre BH1640-08A,"Otras Marcas, Relojes",$145.00,https://timecenter.ec/wp-content/uploads/2021/04/RELOJ-CITIZEN-5-300x300.jpg
Reloj Citizen para Hombre BK2523-04E,"Otras Marcas, Relojes",$145.00,https://timecenter.ec/wp-content/uploads/2021/04/Sin-titulo-7-2-300x300.jpg
Patillera Babylisspro Inalámbrico Fx787S,Patillera,$145.00,https://timecenter.ec/wp-content/uploads/2021/03/patillera--300x300.jpg
Reloj Fossil Hombre FS5131,"Fossil, Relojes",$145.00,https://timecenter.ec/wp-content/uploads/2019/12/fs5131-300x300.png
"Reloj Fossil Analógico, Multifunción Para Hombre FS5170","Fossil, Relojería, Relojes",$145.00,https://timecenter.ec/wp-content/uploads/2019/07/FOSSIL-FS5170-300x300.jpg
"Teléfono Panansonic Alámbrico KT7730X-B, Programador","Tecnología, Teléfono",$145.00,https://timecenter.ec/wp-content/uploads/2018/08/Telefono-Panasonic-KX-T7730X-B-300x300.jpg
Microondas Electrolux 28litros Con Grill Cromado EMDN28G3MLG,Cocina,$142.00,https://timecenter.ec/wp-content/uploads/2021/02/EMDN28G3MLG-300x300.jpg
Reloj D’Mario Analógico Para Hombre ZF3117 BLACK,"Otras Marcas, Relojería, Relojes",$140.00,https://timecenter.ec/wp-content/uploads/2020/11/ZF3117-BLACK-300x300.jpg
Reloj D’Mario Analógico Para Hombre ZF3117,"Otras Marcas, Relojería, Relojes",$140.00,https://timecenter.ec/wp-content/uploads/2020/11/ZF3117-300x300.jpg
Reloj Fossil Cronometro ES3883,"Fossil, Relojes",$140.00,https://timecenter.ec/wp-content/uploads/2019/12/ES3883-300x300.png
"Reloj Fossil, Multifunción  BQ1122","Fossil, Relojería, Relojes",$140.00,https://timecenter.ec/wp-content/uploads/2019/12/BQ1122-1-300x300.png
Secadora + Plancha de Cabello Profesional Hip by Babyliss Pro Iónica,"Planchas de Cabello, Secadoras de Cabello",$139.99,https://timecenter.ec/wp-content/uploads/2020/09/SECADORA-PLANCHA-BABYLISS-PRO-BHCI2162-VILETA-w-300x300.jpg
Secadora + Plancha de Cabello Profesional Hip by Babyliss Pro Iónica,"Planchas de Cabello, Secadoras de Cabello",$139.99,https://timecenter.ec/wp-content/uploads/2020/09/SECADORA-PLANCHA-BABYLISS-PRO-BHCI2162-1-300x300.jpg
Trapeador Limpiador A Vapor Electrolux Elimina 99.9% Bacterias Mop11,Aspiradoras,$139.99,https://timecenter.ec/wp-content/uploads/2020/05/Limpiador-a-Vapor--300x300.jpg
Campana Extractora Electrolux 3 Velocidades 80 Cm Acero Inox,Cocina,$139.99,https://timecenter.ec/wp-content/uploads/2020/02/Campana-EJSE306TBLS-w-300x300.jpg
Plancha De Cabello Babyliss Profesional Optima 3100 De Acero,"Planchas de Cabello, Salud y Belleza",$139.00$152.00,https://timecenter.ec/wp-content/uploads/2021/06/Optima-3100-300x300.jpg
Reloj Casio Formal  De Acero Inoxidable Negro MTD-1075BK-1A2VDF,"Casio Formal, Relojes",$138.00,https://timecenter.ec/wp-content/uploads/2020/06/MTD-1075BK-1-300x300.jpg
Reloj Fossil Analógico Para Hombre FS5532,"Fossil, Relojería, Relojes",$137.00,https://timecenter.ec/wp-content/uploads/2019/08/254-300x300.png
Reloj Casio Edifice Para Hombre Ef-510,"Casio Formal, Relojes",$137.00$160.00,https://timecenter.ec/wp-content/uploads/2019/05/casio-1-300x300.jpg
"Reloj Casio G-shock Digital, Analógico Para Hombre GA-100BT-1ADR",G-Shock,$135.00,https://timecenter.ec/wp-content/uploads/2021/07/CASIO-35-300x300.jpg
Zapatos Deportivos Nike Hombre Caminar AIR MAX 95 ESSENTIAL AT9865 001,Zapatos,$135.00,https://timecenter.ec/wp-content/uploads/2021/07/NIKE--300x300.jpg
Reloj D’Mario Analógico Para Mujer FG9302,"Otras Marcas, Relojería, Relojes",$135.00,https://timecenter.ec/wp-content/uploads/2020/11/FG9302-300x300.jpg
Aspiradora Electrolux New ERGORAPIDO ERG21,"Aspiradoras, Hogar",$135.00$148.00,https://timecenter.ec/wp-content/uploads/2020/06/ERG21-3-300x300.jpg
Reloj Fossil Analógico Para Hombre FS4852,"Fossil, Relojería, Relojes",$135.00,https://timecenter.ec/wp-content/uploads/2019/05/109-300x300.png
Máquina Cortadora de Cabello Wahl Legend. Combo Barbero con Patillera,"Cortadoras de Cabello, Patillera, Profesional",$135.00,https://timecenter.ec/wp-content/uploads/2018/05/Cortadora-WAHL-Profesional-08180-008-300x300.jpg
Dispensador De Agua Electrolux Con Gabinete Eqs20c3musw,Dispensadores,$134.99$165.00,https://timecenter.ec/wp-content/uploads/2019/12/121-300x300.jpg
Aspiradora Electrolux Sin Bolsa 1800w Filtro Hepa Eas31,"Aspiradoras, Hogar",$134.99$145.00,https://timecenter.ec/wp-content/uploads/2019/11/41A-300x300.jpg
Plancha De Cabello Babyliss Profesional Optima 3000 De Acero,"Planchas de Cabello, Salud y Belleza",$134.99$149.00,https://timecenter.ec/wp-content/uploads/2018/04/Plancha-Babyliss-Optima-De-Acero-3100-De-1″-300x300.jpg
Hidrolavadora Electrolux Lavado A Presión 1450w Ews31,"Aspiradoras, Hogar",$134.00,https://timecenter.ec/wp-content/uploads/2019/11/65-300x300.jpg
Patillera Babylisspro Inalámbrico Fx788rg,Patillera,$133.00,https://timecenter.ec/wp-content/uploads/2019/09/80-300x300.jpg
"Reloj Casio Baby-g Digital, Análogico Para Hombre Y Mujer Bga-230-3b",Baby G,$133.00,https://timecenter.ec/wp-content/uploads/2019/08/44-300x300.png
Zapatos Deportivos Nike Hombre Air Max 849559-001,Zapatos,$130.00,https://timecenter.ec/wp-content/uploads/2020/12/NIKE-300x300.jpg
Reloj Fossil Analógico Para Hombre FS5340,"Fossil, Relojería, Relojes",$130.00,https://timecenter.ec/wp-content/uploads/2019/05/6-300x300.png
Vaporizador De Ropa Electrolux 1600w Gst10,"Hogar, Planchas de Ropa",$129.99,https://timecenter.ec/wp-content/uploads/2019/11/108-300x300.jpg
Rizador Profesional Babyliss Pro Miracurl Pinza Tenaza,Pinzas Rizadoras,$129.90,https://timecenter.ec/wp-content/uploads/2018/06/PLANCHA-babntmc2-300x300.jpg
Reloj Casio Beside Cronometro Formal BEM-512D-1AVDF,Casio Formal,$129.00,https://timecenter.ec/wp-content/uploads/2020/06/BEM-512D-1AVDF-300x300.jpg
Climatizador Electrolux 4 en 1 Calefactor Enfriador Purificador e Aire,Aire Acondicionado,$128.99,https://timecenter.ec/wp-content/uploads/2021/04/Calefactor-Electrolux-300x300.jpg
"Reloj Casio Baby-g Digital, Análogico Para Mujer Bga-180-2b3",Baby G,$127.00,https://timecenter.ec/wp-content/uploads/2019/08/37-1-300x300.png
Freidora De Aire Oster 3.2 Litros Ckstaf7601-013,"Cocina, Hogar",$126.99$148.00,https://timecenter.ec/wp-content/uploads/2020/06/Ckstaf7601-013-300x300.jpg
Reloj Casio G-shock Digital Para Hombre GD-400-2DR,"G-Shock, Relojería, Relojes",$125.00$165.00,https://timecenter.ec/wp-content/uploads/2021/07/CASIO-37-300x300.jpg
Reloj Fossil Hombre FS5321,"Fossil, Relojes",$125.00,https://timecenter.ec/wp-content/uploads/2019/12/FS-5321-300x300.png
Reloj Fossil Analógico Para Hombre FS5376,"Fossil, Relojería, Relojes",$125.00,https://timecenter.ec/wp-content/uploads/2019/05/7-300x300.png
Reloj Casio G-shock Digital Para Hombre GD-400-4,"G-Shock, Relojería, Relojes",$125.00$165.00,https://timecenter.ec/wp-content/uploads/2018/09/497-300x300.png
Reloj Casio G-shock Digital Para Hombre GD-400-3DR,"G-Shock, Relojería, Relojes",$125.00$165.00,https://timecenter.ec/wp-content/uploads/2018/04/483-300x300.png
Reloj Casio G-shock Digital Para Hombre G-2900F-1VDR,"G-Shock, Relojería, Relojes",$125.00$175.00,https://timecenter.ec/wp-content/uploads/2018/04/486-300x300.png
Calculadora Gráfica Casio FX-9750GII,Calculadora,$125.00,https://timecenter.ec/wp-content/uploads/2018/01/Calculadora-Casio-FX9750GII-300x300.jpg
Microondas Electrolux 28 Litros Con Grill Blanco EMDN28G3MLW,Cocina,$124.99,https://timecenter.ec/wp-content/uploads/2020/01/EMDN28G3MLW-300x300.jpg
Aspiradora Electrolux Con Bolsa 1800 W Filtro Hepa Eqp20,"Aspiradoras, Hogar",$124.99,https://timecenter.ec/wp-content/uploads/2019/11/Aspiradora-Electrolux-Con-Bolsa-1800-W-Filtro-Hepa-Eqp20-300x300.jpg
Reloj Fossil Analógico Para Hombre FS5530,"Fossil, Relojería, Relojes",$124.00$137.00,https://timecenter.ec/wp-content/uploads/2019/05/Reloj-Fossil-Analógico-Para-Hombre-FS5530-300x300.png
Vaso Tritan de Licuadora Oster Xpert Pro 8 tazas,Cocina,$120.50,https://timecenter.ec/wp-content/uploads/2020/12/PLANTILLA-18-300x300.jpg
Reloj Casio Hombre CHF-100-1VDR,Casio Digital,$120.00,https://timecenter.ec/wp-content/uploads/2021/04/RELOJ-CASIO-5-300x300.jpg
Reloj Citizen para Hombre BM2001-04E,"Otras Marcas, Relojes",$120.00,https://timecenter.ec/wp-content/uploads/2021/04/RELOJ-CITIZEN-BF2001-04E-300x300.jpg
Reloj Fossil Analógico Para Hombre FS5398,"Fossil, Relojes",$120.00,https://timecenter.ec/wp-content/uploads/2020/11/fs5398-300x300.jpg
Reloj Fossil Analógico Para Hombre FS5497,"Fossil, Relojes",$120.00,https://timecenter.ec/wp-content/uploads/2020/11/fs5497-300x300.jpg
Reloj Casio Deportivo para Hombre Mtd-1072-4avdf,Casio Analógico,$120.00$170.00,https://timecenter.ec/wp-content/uploads/2019/06/505-300x300.png
Reloj Fossil Analógico Para Hombre  FS5543,"Fossil, Relojería, Relojes",$120.00$137.00,https://timecenter.ec/wp-content/uploads/2019/05/Reloj-Fossil-Analógico-Para-Hombre-FS5543-300x300.png
"Teléfono Panasonic Inalámbrico Kx-tgd513, Con Bloqueo De Llamadas","Tecnología, Teléfono",$120.00,https://timecenter.ec/wp-content/uploads/2018/05/p-8-300x300.jpg
Zapatos Puma RS-2K Soft Metal para Mujer 374666 02 Para Correr,Zapatos,$119.90,https://timecenter.ec/wp-content/uploads/2021/03/PUMA-19-300x300.jpg
Cortadora de Cabello Profesional Wahl Inalámbrica Magic Clip 5 estrellas,Profesional,$119.90,https://timecenter.ec/wp-content/uploads/2020/07/magic-clip-300x300.jpg
Samsung Ls19f355 Led 19in 1366×768,Sin categorizar,$119.50,https://timecenter.ec/wp-content/uploads/2018/10/69-300x300.png
Plancha De Cabello BabylissPro Vented Iónica Profesional Seco-Húmedo 1 1/2″,Planchas de Cabello,$119.00,https://timecenter.ec/wp-content/uploads/2021/01/BNT4093TSR-300x300.jpg
Licuadora Electrolux Expressionist Blp50,"Cocina, Hogar",$119.00,https://timecenter.ec/wp-content/uploads/2019/12/115-300x300.jpg
Teléfono Panasonic Inalámbrico 3 Auriculares  KXTGC353LA B,Teléfono,$118.00,https://timecenter.ec/wp-content/uploads/2020/11/KXTGC353LA-B-300x300.jpg
Patillera Recargable Detailer Wahl 08163-208,"Patillera, Salud y Belleza",$118.00,https://timecenter.ec/wp-content/uploads/2019/05/13-3-300x300.png
Plancha De Cabello Babylisspro Profesional Graphite Titanium Iónico Seco-Húmedo BGT4093UX,"Planchas de Cabello, Salud y Belleza",$117.00,https://timecenter.ec/wp-content/uploads/2021/01/plancha-8-300x300.jpg
Reloj Casio Deportivo Para Hombre Mtd-1080-8av,Casio Analógico,$115.00,https://timecenter.ec/wp-content/uploads/2019/06/516-300x300.png
Reloj Casio Edifice Para Hombre Ef-133d-1avudf,"Casio Formal, Relojes",$115.00,https://timecenter.ec/wp-content/uploads/2019/05/Reloj-Casio-Edifice-EF-133D-1AVUDF-300x300.png
Reloj Fossil Analógico Para Hombre AM4554,"Fossil, Relojería, Relojes",$115.00,https://timecenter.ec/wp-content/uploads/2019/05/94-300x300.png
Reloj Fossil Analógico Para Hombre AM4512,"Fossil, Relojería, Relojes",$115.00,https://timecenter.ec/wp-content/uploads/2019/05/Am4512-1-300x300.png
Reloj Fossil Analógico Para Hombre AM4514,"Fossil, Relojería, Relojes",$115.00,https://timecenter.ec/wp-content/uploads/2019/05/Am4514-300x300.png
Reloj Casio G-shock Digital Para Hombre Dw-6900lu-8,"G-Shock, Relojería, Relojes",$115.00,https://timecenter.ec/wp-content/uploads/2019/02/502-300x300.png
Campana Extractora Electrolux 3 Velocidades 60cm,Cocina,$112.00,https://timecenter.ec/wp-content/uploads/2020/02/Campana-EJSE306TBLS-w-300x300.jpg
Reloj Casio Multifunción Para Hombre Mtp-e303sg,"Casio Formal, Relojería, Relojes",$112.00,https://timecenter.ec/wp-content/uploads/2019/05/456-300x300.png
Reloj Casio Analógico Para Hombre Mtp-e203d-2avdf,"Casio Formal, Relojería, Relojes",$112.00,https://timecenter.ec/wp-content/uploads/2019/05/439-1-300x300.png
Combo Profesional Wahl Cortador Y Patillera Modelo Designer,"Patillera, Profesional",$112.00,https://timecenter.ec/wp-content/uploads/2018/06/Cortadora-Wahl-All-Star-Combo-2-300x300.jpg
"Cortadora Wahl De Cabello, Profesional Combo X2, Designer","Cortadoras de Cabello, Profesional, Salud y Belleza",$112.00,https://timecenter.ec/wp-content/uploads/2018/02/Cortadora-Wahl-Combo--300x300.jpg
Parrilla y plancha Oster Bioceramica CKSTGR3006,Cocina,$110.00,https://timecenter.ec/wp-content/uploads/2020/10/PARRILLA-OSTER-ANTI-ADH-300x300.jpg
Plancha De Cabello Babylisspro Profesional Graphite BGT183UC,"Planchas de Cabello, Salud y Belleza",$110.00,https://timecenter.ec/wp-content/uploads/2019/12/Plancha-de-Cabello-Babyliss-Grafito-BGT183UC-300x300.jpg
Reloj Casio Analógico Para Mujer Ltp–1357sg-1cdf,Casio Formal,$110.00,https://timecenter.ec/wp-content/uploads/2019/06/651-300x300.png
Reloj Casio G-shock Digital Para Hombre DW-6900CB-1DS,"G-Shock, Relojería, Relojes",$110.00,https://timecenter.ec/wp-content/uploads/2019/02/503-300x300.png
"Licuadora Master Industrial Prima, KTBR5330, 2500 Watts","Cocina, Hogar",$110.00$129.99,https://timecenter.ec/wp-content/uploads/2018/09/LICUADORA-MASTER-INDUSTRIAL-PRIMA-300x300.jpg
Cortadora De Cabello Wahl Senior Profesional Con Cable 08500-008,Profesional,$109.00,https://timecenter.ec/wp-content/uploads/2021/05/WAHL-SENIOR-300x300.jpg
Sistema inalámbrico Mesh para toda la casa Nexxt Vektor3600-AC,Reguladores de Voltaje,$109.00,https://timecenter.ec/wp-content/uploads/2021/01/HP-43-300x300.jpg
Plancha de Cabello Babyliss Pro Nano Titanium Edición Limitada,"Planchas de Cabello, Salud y Belleza",$109.00,https://timecenter.ec/wp-content/uploads/2020/07/PLANCHA-EDICION-LIMITADA-roja-1-300x300.jpg
Plancha De Cabello Babylisspro Profesional Ultra Delgado Nano Titanium 2″ BABNT3074,"Planchas de Cabello, Salud y Belleza",$109.00,https://timecenter.ec/wp-content/uploads/2018/05/PLANCHA-DE-CBELLO-BABNT-3074T-300x300.jpg
Aspiradora Electrolux De Agua Y Polvo 1300w Gt30n,"Aspiradoras, Hogar",$107.90$128.00,https://timecenter.ec/wp-content/uploads/2019/11/ELECTROLUX-2-300x300.jpg
Cortadora De Cabello Wahl Profesional Peines Trae Capa 08202-008,Profesional,$107.00,https://timecenter.ec/wp-content/uploads/2019/11/127-300x300.png
Patillera Babylisspro Inalámbrico De Litio Fx59z,Patillera,$106.00,https://timecenter.ec/wp-content/uploads/2019/09/88-1-300x300.jpg
Reloj Casio G-shock Digital Para Hombre Dw-6900nb-1,"G-Shock, Relojería, Relojes",$105.00,https://timecenter.ec/wp-content/uploads/2019/08/69-1-300x300.png
Reloj Casio G-shock Digital Para Hombre Dw-5700bbmb,"G-Shock, Relojería, Relojes",$105.00,https://timecenter.ec/wp-content/uploads/2019/08/55-300x300.png
Freidora De Aire Prima 5 Litros AF-20,Cocina,$104.99,https://timecenter.ec/wp-content/uploads/2020/08/AF20-FREIDORA-300x300.jpg
Plancha de Cabello Babyliss Pro Húmedo-Seco Nano Titanium,"Planchas de Cabello, Salud y Belleza",$102.00,https://timecenter.ec/wp-content/uploads/2018/04/Plancha-de-Cabello-Babyliss-BABNT2091T-300x300.jpg
Selladora Al Vacio Electrolux Para Alimentos,Cocina,$99.99,https://timecenter.ec/wp-content/uploads/2021/05/SELLADORA-ELECTROLUX-300x300.jpg
Reloj Casio Digital Analógico Para Hombre AMW-830L-1AV,Casio Formal,$99.00,https://timecenter.ec/wp-content/uploads/2021/08/CASIO-15-2-300x300.jpg
