Item,Category,Price,ImagenURL
Reloj Casio Digital Para Mujer Lw-200-4bvdf,Casio Digital,$35.00,https://timecenter.ec/wp-content/uploads/2019/06/349-1-300x300.png
Reloj Casio Analógico Para Mujer Lrw-200h,Casio Analógico,$35.00,https://timecenter.ec/wp-content/uploads/2019/06/339-300x300.jpg
Reloj Q&Q Analógico Para Hombre Qa60j004y,QyQ Formal,$35.00,https://timecenter.ec/wp-content/uploads/2019/04/113-300x300.jpg
Calculadora Casio Programable Fx-3650PII,Calculadora,$35.00,https://timecenter.ec/wp-content/uploads/2019/02/378-300x300.png
Reloj Casio Digital Para Mujer Lw-200-7av,Casio Digital,$35.00,https://timecenter.ec/wp-content/uploads/2018/09/LOGO-CORREGIDO-14-300x300.png
Secadora de Cabello Revlon Viajero Rvdr 5175,"Salud y Belleza, Secadoras de Cabello",$35.00,https://timecenter.ec/wp-content/uploads/2018/05/Secador-de-Cabello-Revlon-RVDR-5175-300x300.jpg
Churero Conico Revlon Pinza De Ondular Cabello,"Pinzas Rizadoras, Salud y Belleza",$35.00,https://timecenter.ec/wp-content/uploads/2018/05/Churero-Revlon-rvir1090-300x300.jpg
Reloj Casio Analógico Para Hombre MTP-1175E-7B,Casio Formal,$35.00,https://timecenter.ec/wp-content/uploads/2018/04/RELOJ-CASIO-MTP-1175E-7B-300x300.jpg
Reloj Casio Digital LW-203-1AVDF Para Hombre y Mujer Wr50m,Casio Digital,$35.00,https://timecenter.ec/wp-content/uploads/2018/04/RELOJ-CASIO-17-300x300.jpg
Olla Arrocera Oster 4722,Cocina,$35.00,https://timecenter.ec/wp-content/uploads/2018/02/Olla-Arrocera-Oster-4722-Ag-1-300x300.jpg
Reloj Casio Analógico Para Mujer Ltp-v006l,Casio Analógico,$35.00,https://timecenter.ec/wp-content/uploads/2018/02/RELOJ-CVASIO-LTP-V006-300x300.jpg
Reloj Casio Analógico Para Mujer Lrw-200h,Casio Analógico,$35.00,https://timecenter.ec/wp-content/uploads/2018/02/319-3-300x300.png
"Reloj Casio Digital Para Mujer, Niña y Niño Lw-200",Casio Digital,$35.00,https://timecenter.ec/wp-content/uploads/2018/02/reloj-casioo-lw-200-300x300.jpg
Reloj Casio Analógico Para Mujer Ltp-v006d,Casio Formal,$35.00,https://timecenter.ec/wp-content/uploads/2018/02/702-300x300.png
Reloj Casio Analogico Para Mujer Ltp-v004d,Casio Formal,$35.00,https://timecenter.ec/wp-content/uploads/2018/02/RELOJ-CASIO-ltp--300x300.jpg
Reloj Casio Analógico Para Hombre Mtp-v006d-7b,Casio Formal,$35.00,https://timecenter.ec/wp-content/uploads/2018/01/586-300x300.png
Reloj Casio Analógico Hda-600b-1bvdf,Casio Analógico,$35.00,https://timecenter.ec/wp-content/uploads/2018/01/RELOJ-CASIO-hda-600b-300x300.jpg
Reloj Casio Analógico Para Hombre Mrw-200hc-4bv,Casio Analógico,$35.00,https://timecenter.ec/wp-content/uploads/2018/01/421-300x300.png
Calefactor Ventilador Compacto Black+Decker BHD101W Blanco 1500w,Aire Acondicionado,$34.99,https://timecenter.ec/wp-content/uploads/2019/11/CALEFACTOR-300x300.jpg
"Audífono con Micrófono Sony MDRZX110AP, Negro",Audífonos,$34.50,https://timecenter.ec/wp-content/uploads/2021/03/sony-3-300x300.jpg
Zapatos Deportivos West Hombre JX7807A,Zapatos,$34.00,https://timecenter.ec/wp-content/uploads/2021/07/west-59-300x300.jpg
Zapatos Deportivos West Hombre JX7807C DK,Zapatos,$34.00,https://timecenter.ec/wp-content/uploads/2021/08/west--300x300.jpg
Zapatos Deportivos West Hombre JX7807B,Zapatos,$34.00,https://timecenter.ec/wp-content/uploads/2021/07/west-59-300x300.jpg
Zapatos Deportivos West Mujer JX-2749EL,Zapatos,$34.00,https://timecenter.ec/wp-content/uploads/2021/07/west-55-300x300.jpg
Zapatos Deportivos West Hombre JX-2749B,Zapatos,$34.00,https://timecenter.ec/wp-content/uploads/2021/07/west-53-300x300.jpg
Zapatos Deportivos West Mujer JX-2749CL,Zapatos,$34.00$44.00,https://timecenter.ec/wp-content/uploads/2021/06/west-43-300x300.jpg
Zapatos Casual West Hombre  DA05572A,Zapatos,$34.00$44.00,https://timecenter.ec/wp-content/uploads/2021/06/west-38-300x300.jpg
Zapatos Casual West Hombre DA-05572D,Zapatos,$34.00$44.00,https://timecenter.ec/wp-content/uploads/2021/06/west-37-300x300.jpg
Reloj Casio Digital Para Hombre W-96H-3A,Casio Digital,$34.00,https://timecenter.ec/wp-content/uploads/2021/05/RELOJ-CASIO-46-300x300.jpg
Reloj Casio Digital Para Hombre W-96H-1B,Casio Digital,$34.00,https://timecenter.ec/wp-content/uploads/2021/05/RELOJ-CASIO-45-300x300.jpg
Reloj Casio Digital Para Hombre W-219H-2A,Casio Digital,$34.00,https://timecenter.ec/wp-content/uploads/2021/05/RELOJ-CASIO-43-300x300.jpg
Reloj Casio Digital Para Hombre W-219H-1A,Casio Digital,$34.00,https://timecenter.ec/wp-content/uploads/2021/05/RELOJ-CASIO-42-300x300.jpg
Reloj Casio Analógico Para Hombre MTP-V004L-1B2,Casio Formal,$34.00,https://timecenter.ec/wp-content/uploads/2021/05/RELOJ-CASIO-32-300x300.jpg
Reloj Casio Analógico Para Mujer LTP-V002D-4B,Casio Formal,$34.00,https://timecenter.ec/wp-content/uploads/2021/05/RELOJ-CASIO-12-300x300.jpg
Reloj Casio Analógico Para Mujer LTP-V002D-2B,Casio Formal,$34.00,https://timecenter.ec/wp-content/uploads/2021/05/RELOJ-CASIO-la-11wl-3-300x300.jpg
Reloj Casio Analógico Para Mujer LTP-V002D-1B,Casio Formal,$34.00,https://timecenter.ec/wp-content/uploads/2021/05/RELOJ-CASIO-10-300x300.jpg
Reloj Casio Digital Para Hombre W-800HM-2AVDF,Casio Digital,$34.00,https://timecenter.ec/wp-content/uploads/2021/04/RELOJ-CASIO-W-800HM-2AVDF-300x300.jpg
Reloj Casio Digital Para Hombre W-96H-4A,Casio Digital,$34.00,https://timecenter.ec/wp-content/uploads/2021/04/RELOJ-CASIO-W-96H-4A-300x300.jpg
Reloj Casio Digital Para Hombre W-96H-4A2VDF,Casio Digital,$34.00,https://timecenter.ec/wp-content/uploads/2021/04/RELOJ-CASIO-2-1-300x300.jpg
Plancha Alisadora De Cabello Revlon Cerámica 2 Pulgadas RVST2182,"Planchas de Cabello, Salud y Belleza",$34.00,https://timecenter.ec/wp-content/uploads/2021/04/Plancha-de-Cabello-RVST2182-300x300.jpg
Zapatos Deportivos West Mujer JX2749DL gris con rosado,Zapatos,$34.00$44.00,https://timecenter.ec/wp-content/uploads/2021/01/ZAPATOS-WEST-18-300x300.jpg
Zapatos Deportivos West Hombre JX-2749F Negro,Zapatos,$34.00$44.00,https://timecenter.ec/wp-content/uploads/2021/01/ZAPATOS-WEST-7-1-6-300x300.jpg
Zapatos Deportivos West Hombre JX-2749I Gris,Zapatos,$34.00$44.00,https://timecenter.ec/wp-content/uploads/2021/01/ZAPATOS-WEST-14-300x300.jpg
Zapatos Deportivos West Mujer JX2749PL Navy Turqueza,Zapatos,$34.00$44.00,https://timecenter.ec/wp-content/uploads/2021/01/ZAPATOS-WEST-3-300x300.jpg
Zapatos Deportivos West Mujer JX2749AL Gris Coral,Zapatos,$34.00$44.00,https://timecenter.ec/wp-content/uploads/2021/01/ZAPATOS-WEST-7-1-3-300x300.jpg
Audífono JBL Tune 500 Blanco con Micrófono,Audífonos,$34.00,https://timecenter.ec/wp-content/uploads/2020/12/JBL-TUNE-500-300x300.jpg
Zapatos Deportivos West WST005AL,Zapatos,$34.00$44.00,https://timecenter.ec/wp-content/uploads/2020/10/WST005AL-BLACKFUCSIA-300x300.jpg
Zapatos Deportivos West de Hombre JX-1856521A,Zapatos,$34.00$44.00,https://timecenter.ec/wp-content/uploads/2020/09/JX-1856521A-BLACKRED-300x300.jpg
Zapatos Deportivos West de Hombre JX-1853728C,Zapatos,$34.00$44.00,https://timecenter.ec/wp-content/uploads/2020/09/JX-1853728C-GREYBLACK--300x300.jpg
Calculadora De Impresión Casio HR-8RC-WE,Calculadora,$34.00,https://timecenter.ec/wp-content/uploads/2020/08/HR-8RC-WE-300x300.jpg
Zapatos Deportivos West Original De Mujer JX-17169FL,Zapatos,$34.00$44.00,https://timecenter.ec/wp-content/uploads/2020/01/JX-17169-300x300.jpg
Zapatos Deportivos West Original Para Mujer L18558CK,Zapatos,$34.00$42.00,https://timecenter.ec/wp-content/uploads/2019/09/L18558CK-300x300.jpg
Zapatos Deportivos West Original De Hombre JX-7832A,Zapatos,$34.00$42.00,https://timecenter.ec/wp-content/uploads/2019/09/JX7832A--300x300.jpg
Cartucho De Tinta Hp 60 Tricolor,Cartuchos- Tintas,$34.00,https://timecenter.ec/wp-content/uploads/2019/09/HP-8-300x300.jpg
Zapatos Deportivos West Original De Hombre JX-1853596C,Zapatos,$34.00$42.00,https://timecenter.ec/wp-content/uploads/2019/08/JX-1853596C--300x300.jpg
Zapatos Deportivos West Original De Hombre BY-18559B,Zapatos,$34.00$42.00,https://timecenter.ec/wp-content/uploads/2019/07/L18559B--300x300.jpg
Zapatos Deportivos West Original De Hombre JX-7808D,Zapatos,$34.00$42.00,https://timecenter.ec/wp-content/uploads/2019/07/JX7808D--300x300.jpg
Zapatos Deportivos West Original De Hombre BY-18559A,Zapatos,$34.00$42.00,https://timecenter.ec/wp-content/uploads/2019/07/L18559A-300x300.jpg
Zapatos Deportivos West Original Hombre JX-1856035D,Zapatos,$34.00$42.00,https://timecenter.ec/wp-content/uploads/2019/07/JX-1856035D--300x300.jpg
Reloj Casio Analógico Para Mujer Ltp-v002d-7avdf,Casio Formal,$34.00,https://timecenter.ec/wp-content/uploads/2019/07/880-300x300.png
Kit Depiladora Femenina Wahl Recargable 09865-100,Depilador Femenina,$34.00,https://timecenter.ec/wp-content/uploads/2019/05/6-3-300x300.png
Plancha De Cabello Remington Seco Húmedo Con Cerámica S-7310,"Planchas de Cabello, Salud y Belleza",$34.00,https://timecenter.ec/wp-content/uploads/2019/02/5-300x300.png
Reloj Casio Digital Para Hombre W-96h-9av,Casio Digital,$34.00,https://timecenter.ec/wp-content/uploads/2018/09/LOGO-CORREGIDO-4-300x300.png
Reloj Casio Digital Para Hombre  W-800h-1av,"Casio Digital, Relojería, Relojes",$34.00,https://timecenter.ec/wp-content/uploads/2018/09/LOGO-CORREGIDO-3-300x300.png
Reloj Casio Digital Para Hombre y Mujer A-158wa-1,Casio Digital,$34.00,https://timecenter.ec/wp-content/uploads/2018/04/612-300x300.png
"Reloj Casio Con Calculadora, Hombre Ca-56",Casio Digital,$34.00,https://timecenter.ec/wp-content/uploads/2018/01/RELOJ-CASIO-CA-56-1-300x300.jpg
Reloj Casio Digital Para Hombre y Niño W-212h-1a,Casio Digital,$34.00,https://timecenter.ec/wp-content/uploads/2018/01/RELOJ-CASIO-212-300x300.jpg
Tripode Selfie Stick Samsung Bluethooth,"Celulares, Sin categorizar, Tecnología",$33.99,https://timecenter.ec/wp-content/uploads/2020/11/SAMSUNG-SELFIE-STICK-300x300.jpg
Batidora Oster 5 Velocidades Mezcladora Y Amasadora,"Cocina, Hogar",$33.95,https://timecenter.ec/wp-content/uploads/2018/07/Batidora-de-mano-Oster-2499013-300x300.png
Sopladora de Aire Anera Para Limpieza 700w,Electrónica,$33.75,https://timecenter.ec/wp-content/uploads/2021/07/SOPLADORA-1-300x300.jpg
Maquina Cortadora de Cabello Babyliss For Men 18 piezas,Doméstico,$33.50,https://timecenter.ec/wp-content/uploads/2021/03/CORTADORA-7-300x300.jpg
Cuchillo Oster Eléctrico Con Estuche Y Accesorio,"Cocina, Hogar",$33.00,https://timecenter.ec/wp-content/uploads/2019/08/2-5-300x300.png
Secadora De Cabello Panasonic Eh-ne50-s225,Secadoras de Cabello,$33.00$37.00,https://timecenter.ec/wp-content/uploads/2019/04/706-1-300x300.png
Reloj Casio Analógico Para Mujer Ltp-1094q-7b1rdf,Casio Formal,$33.00,https://timecenter.ec/wp-content/uploads/2019/03/440-300x300.jpg
Set De 4 Cepillos Babyliss Termico Nano Titanium Profesional,Cepillos,$33.00,https://timecenter.ec/wp-content/uploads/2018/09/logo-bybyliss-300x300.jpg
Calculadora Científica Casio FX-991LAX,Calculadora,$33.00,https://timecenter.ec/wp-content/uploads/2018/01/CALCULADORA-CASIO-FX991lax-300x300.jpg
Accesorio Oster Para Exprimir Cítricos 750ml,Cocina,$32.75,https://timecenter.ec/wp-content/uploads/2018/09/BLSTCJW00-011-300x300.jpg
Mouse Inalámbrico Klip Xtreme Kmw-750,"Mouse, Tecnología",$32.50,https://timecenter.ec/wp-content/uploads/2019/11/13-300x300.jpg
Zapatos Deportivos West Hombre JX7816C,Zapatos,$32.00,https://timecenter.ec/wp-content/uploads/2021/08/west-62-300x300.jpg
Zapatos Deportivos West Hombre JX7832C,Zapatos,$32.00,https://timecenter.ec/wp-content/uploads/2021/07/west-57-300x300.jpg
Zapatos Deportivos West Hombre JX7879D,Zapatos,$32.00,https://timecenter.ec/wp-content/uploads/2021/07/west-49-300x300.jpg
Zapatos Deportivos West Niños JX7871DG,Zapatos,$2.00$32.00,https://timecenter.ec/wp-content/uploads/2021/07/west-48-300x300.jpg
Zapatos Deportivos West Mujer JX7879CL,Zapatos,$32.00,https://timecenter.ec/wp-content/uploads/2021/07/west-JX7879CL-300x300.jpg
Zapatos Deportivos West Hombre JX7887B,Zapatos,$32.00$44.00,https://timecenter.ec/wp-content/uploads/2021/06/west-34-300x300.jpg
Zapatos Deportivos West Hombre JX18117E,Zapatos,$32.00$44.00,https://timecenter.ec/wp-content/uploads/2021/06/west-42-300x300.jpg
Zapatos Deportivos West Hombre JX19434D,Zapatos,$32.00$44.00,https://timecenter.ec/wp-content/uploads/2021/06/west-32-300x300.jpg
Zapatos Deportivos West Mujer JX18117DI,Zapatos,$32.00$44.00,https://timecenter.ec/wp-content/uploads/2021/06/west-30-300x300.jpg
Zapatos Deportivos West Hombre Jx18117c,Zapatos,$32.00$44.00,https://timecenter.ec/wp-content/uploads/2021/06/west-26-300x300.jpg
Reloj Casio Analógico Para Hombre MTP-V002GL-1B,Casio Formal,$32.00,https://timecenter.ec/wp-content/uploads/2021/05/RELOJ-CASIO-31-300x300.jpg
Reloj Casio Analógico Para Mujer LTP-V006L-7B2,Casio Formal,$32.00,https://timecenter.ec/wp-content/uploads/2021/05/RELOJ-CASIO-14-300x300.jpg
Reloj Casio Analógico Para Mujer LTP-V006L-4B,Casio Formal,$32.00,https://timecenter.ec/wp-content/uploads/2021/05/RELOJ-CASIO-13-300x300.jpg
Afeitadora Remington Rotativa De 3 Cuchillas R3790R,Afeitadoras,$32.00,https://timecenter.ec/wp-content/uploads/2021/05/AFEITADORA--300x300.jpg
Reloj Casio Analógico Para Hombre MTP-V002GL-7B,Casio Formal,$32.00,https://timecenter.ec/wp-content/uploads/2021/04/RELOJ-CASIO-MTP-V002GL-7B-300x300.jpg
Reloj Casio Analógico Con Luz MWC-100H-1AVF,Casio Analógico,$32.00,https://timecenter.ec/wp-content/uploads/2021/04/RELOJ-CASIO-MWC-100H-1AVF-300x300.jpg
Reloj Casio Analógico Con Luz MWC-100H-7AVF,Casio Analógico,$32.00,https://timecenter.ec/wp-content/uploads/2021/04/RELOJ-CASIO-MWC-100H-7AVF-300x300.jpg
Reloj Casio Analógico Para Hombre MTP-V001L-1BU,Casio Formal,$32.00,https://timecenter.ec/wp-content/uploads/2021/04/RELOJ-CASIO-MTP-V001L-1BU-300x300.jpg
Reloj Casio Analógico Para Hombre Mw-600f-1av,Casio Analógico,$32.00,https://timecenter.ec/wp-content/uploads/2021/04/reloj-casio-mw-600-300x300.jpg
"Reloj Casio Digital, Analógico Para Hombre Aw-48HE-9AVDF",Casio Analógico-Digital,$32.00,https://timecenter.ec/wp-content/uploads/2021/04/RELOJ-CASIO-AW-48HE-9AV-300x300.jpg
"Reloj Casio Digital, Analógico Para Hombre Aw-48HE-7AVDF",Casio Analógico-Digital,$32.00,https://timecenter.ec/wp-content/uploads/2021/04/RELOJ-CASIO-AW-48HE-7AV-300x300.jpg
"Reloj Casio Digital, Analógico Para Hombre AW-49HE-2AVDF",Casio Analógico-Digital,$32.00,https://timecenter.ec/wp-content/uploads/2021/04/RELOJ-CASIO-AW-49HE-2AVDF-300x300.jpg
Reloj Casio Digital Para Hombre Y Mujer A159WA-N1DF,Casio Formal,$32.00,https://timecenter.ec/wp-content/uploads/2021/04/RELOJ-CASIO-A159WA-N1DF-300x300.jpg
Reloj Casio Analógico Para Hombre MRW-200HC 7BV,Casio Analógico,$32.00,https://timecenter.ec/wp-content/uploads/2021/04/RELOJ-CASIO-MRW-200HC-7BV-300x300.jpg
Reloj Casio Analógico Para Hombre MRW-200H-7BVDF,Casio Analógico,$32.00,https://timecenter.ec/wp-content/uploads/2021/04/RELOJ-CASIO-MRW-200H-7BVDF-300x300.jpg
Reloj Casio Analógico Para Hombre MRW-200H-1B2VDF,Casio Analógico,$32.00,https://timecenter.ec/wp-content/uploads/2021/04/RELOJ-CASIO-MRW-200H-1B2VDF-300x300.jpg
Reloj Casio Analógico Para Hombre MRW-200H-3BVDF,Casio Analógico,$32.00,https://timecenter.ec/wp-content/uploads/2021/04/MRW-200H-3BVDF-300x300.jpg
Reloj Casio Analógico Para Hombre Mrw-200h-2BVDF,Casio Analógico,$32.00,https://timecenter.ec/wp-content/uploads/2021/04/RELOJ-CASIO-215h--300x300.jpg
Secadora de Cabello Remington AC2015R  Iónica Perla,Secadoras de Cabello,$32.00,https://timecenter.ec/wp-content/uploads/2021/02/EFS01-1-300x300.jpg
Zapatos Deportivos West Hombre JX-18106A Negro con gris,Zapatos,$32.00$44.00,https://timecenter.ec/wp-content/uploads/2021/01/ZAPATOS-WEST--300x300.jpg
Zapatos Deportivos West Hombre JX-18117A navy,Zapatos,$32.00$44.00,https://timecenter.ec/wp-content/uploads/2021/01/ZAPATOS-WEST-15-300x300.jpg
Zapatos Deportivos West Hombre JX-18117B Negro,Zapatos,$32.00$44.00,https://timecenter.ec/wp-content/uploads/2021/01/ZAPATOS-WEST-7-1-300x300.jpg
Zapatos Deportivos West Mujer JX-18117AL negro con fucsia,Zapatos,$32.00$44.00,https://timecenter.ec/wp-content/uploads/2021/01/ZAPATOS-WEST-1-300x300.jpg
Zapatos Deportivos West Hombre BK-18106A,Zapatos,$32.00$44.00,https://timecenter.ec/wp-content/uploads/2021/01/ZAPATOS-WEST-11-300x300.jpg
Zapatos Deportivos West JX2749J,Zapatos,$32.00$44.00,https://timecenter.ec/wp-content/uploads/2021/01/ZAPATOS-WEST-10-300x300.jpg
Zapatos Deportivos West Hombre BK18106C,Zapatos,$32.00$44.00,https://timecenter.ec/wp-content/uploads/2021/01/ZAPATOS-WEST-9-300x300.jpg
Router Nexxt Inalámbrico-N de Alta Potencia 300Mbps,"Accesorio de Computación, Reguladores de Voltaje",$32.00,https://timecenter.ec/wp-content/uploads/2021/01/HP-42-300x300.jpg
Churero Babyliss Pro Rápido Pinza Onduladora para Cabello Zip Curl Curling Iron 1 1/4″ BABR125S,Pinzas Rizadoras,$32.00$60.00,https://timecenter.ec/wp-content/uploads/2020/11/CHURERO-300x300.jpg
Zapatos Deportivos West Original LM4515,Zapatos,$32.00,https://timecenter.ec/wp-content/uploads/2020/11/LM4515-300x300.jpg
Zapatos Deportivos West Original JX-18185A,Zapatos,$32.00,https://timecenter.ec/wp-content/uploads/2020/11/JX-18185A-300x300.jpg
Zapatos Deportivos West Original JX-1856035A,Zapatos,$32.00,https://timecenter.ec/wp-content/uploads/2020/11/JX-1856035A-300x300.jpg
Zapatos Deportivos West Original JX-1856035C,Zapatos,$32.00,https://timecenter.ec/wp-content/uploads/2020/11/jx-1856035c-300x300.jpg
Zapatos Deportivos West Original L19191CK,Zapatos,$32.00,https://timecenter.ec/wp-content/uploads/2020/11/L19191CK-2-300x300.jpg
Zapatos Deportivos West Original L19191AK,Zapatos,$32.00,https://timecenter.ec/wp-content/uploads/2020/11/L19191AK-300x300.jpg
Zapatos Deportivos West Original BK-18570D,Zapatos,$32.00,https://timecenter.ec/wp-content/uploads/2020/11/L18570D-300x300.jpg
Zapatos Deportivos West Original BK-18570B,Zapatos,$32.00,https://timecenter.ec/wp-content/uploads/2020/11/L18570B-300x300.jpg
Regulador de Voltaje Forza RHT06NC Surge Protector 4.00  Pivot RJ45 Coaxial,Reguladores de Voltaje,$32.00,https://timecenter.ec/wp-content/uploads/2020/11/Forza-RHT06NC-Surge-Protector-300x300.jpg
"Batería Forza Para Ups De 12v 9.0ah, Fub-1290",Pilas & Baterías,$32.00,https://timecenter.ec/wp-content/uploads/2020/07/FUB1290-300x300.jpg
Zapatos Deportivos West Para Niñ@ JX-0317LAK,Zapatos,$32.00$36.00,https://timecenter.ec/wp-content/uploads/2020/01/031-7L-2-300x300.jpg
Zapatos Deportivos West Original Para Niñ@ HG-J12,Zapatos,$32.00$38.00,https://timecenter.ec/wp-content/uploads/2020/01/HG-J12A-300x300.jpg
Reloj Casio Analógico Para Hombre Mrw-200H-4B,Casio Analógico,$32.00,https://timecenter.ec/wp-content/uploads/2019/12/RELOJ-CASIO-Mrw-200h-4B-1-300x300.jpg
Reloj Casio Analógico Para Hombre Mrw-200hc-7b2,Casio Analógico,$32.00,https://timecenter.ec/wp-content/uploads/2019/10/67-1-300x300.png
Reloj Q&Q Analógico Para Hombre Y Mujer Db02j001y,QyQ Formal,$32.00,https://timecenter.ec/wp-content/uploads/2019/09/309-300x300.jpg
Reloj Q&Q Analógico Para Mujer Db23j301y,QyQ Formal,$32.00,https://timecenter.ec/wp-content/uploads/2019/09/97-300x300.png
Reloj Casio Analógico Para Hombre Mrw-200hc-2bv,Casio Analógico,$32.00,https://timecenter.ec/wp-content/uploads/2019/09/1001-300x300.png
Reloj Casio Analógico Para Hombre Mrw-200h-1b3v,Casio Analógico,$32.00,https://timecenter.ec/wp-content/uploads/2019/09/986-300x300.png
Zapatos Deportivos West Original Mujer JX-7816FL,Zapatos,$32.00$38.00,https://timecenter.ec/wp-content/uploads/2019/08/JX7816FL--300x300.jpg
Zapatos Deportivos West Original Mujer JX-2749OL,Zapatos,$32.00$38.00,https://timecenter.ec/wp-content/uploads/2019/08/JX2749OL-300x300.jpg
Zapatos Deportivos L.A Gear Para Mujer Gris LM4483,Zapatos,$32.00$38.00,https://timecenter.ec/wp-content/uploads/2019/08/LM4483-A-300x300.jpg
Reloj Casio Analógico Para Mujer Ltp-v001d-1bvdf,Casio Formal,$32.00,https://timecenter.ec/wp-content/uploads/2019/07/878-300x300.png
Reloj Casio Digital Para Hombre W96H2AVDF,"Casio Digital, Relojería, Relojes",$32.00,https://timecenter.ec/wp-content/uploads/2019/06/790-1-300x300.png
Reloj Casio Analógico Para Mujer LTP-V005L-7AUDF,Casio Analógico,$32.00,https://timecenter.ec/wp-content/uploads/2019/06/575-300x300.png
Reloj Casio Analógico Para Mujer LTP-V005L-1AUDF,Casio Analógico,$32.00,https://timecenter.ec/wp-content/uploads/2019/06/564-300x300.png
"CABLE HDMI DE 15M, 10M, 3M. 1.5M.",Cables,$32.00,https://timecenter.ec/wp-content/uploads/2019/04/474-1-300x300.png
Calculadora De Impresión Casio HR-8RC-BK,Calculadora,$32.00,https://timecenter.ec/wp-content/uploads/2019/02/HR-8RC-BK-300x300.jpg
Plancha De Cabello Remington Con Cerámica S1302A,Planchas de Cabello,$32.00,https://timecenter.ec/wp-content/uploads/2019/02/765-4-300x300.jpg
"Mini Plancha De Cabello Babyliss Pro De Nano Titanium, 1/2″","Planchas de Cabello, Salud y Belleza",$32.00,https://timecenter.ec/wp-content/uploads/2018/07/Mini-Plancha-de-Cabello-Babyliss-BABNT3050-A-300x300.jpg
Reloj Casio Digital Para Hombre W-210-1av,Casio Digital,$32.00,https://timecenter.ec/wp-content/uploads/2018/06/RELOJ-CASIO-w2101av-300x300.jpg
Reloj Casio Analógico Para Mujer Ltp-v004l,Casio Analógico,$32.00,https://timecenter.ec/wp-content/uploads/2018/02/609-300x300.png
Secadora de Cabello Revlon Viajera,"Salud y Belleza, Secadoras de Cabello",$32.00,https://timecenter.ec/wp-content/uploads/2018/02/Secador-de-Cabello-Revlon-RVDR5224-B-300x300.jpg
Secador de Cabello Revlon Viajera RVDR5005,"Salud y Belleza, Secadoras de Cabello",$32.00,https://timecenter.ec/wp-content/uploads/2018/02/Secador-de-Cabello-Revlon-RVDR5005-C-300x300.jpg
Reloj Casio Analógico Para Hombre Mw-240,Casio Analógico,$32.00,https://timecenter.ec/wp-content/uploads/2018/02/RELOJ-CASIO-MW-240-2BVDF-300x300.jpg
Reloj Casio Analógico Para Mujer Ltp-v004gl,Casio Formal,$32.00,https://timecenter.ec/wp-content/uploads/2018/02/447-300x300.png
Reloj Casio Analógico Para Mujer Ltp-v002gl,Casio Formal,$32.00,https://timecenter.ec/wp-content/uploads/2018/02/583-300x300.png
"Reloj Casio Digital, Analógico Para Hombre Aw-49h",Casio Analógico-Digital,$32.00,https://timecenter.ec/wp-content/uploads/2018/01/RELOJ-CASIO-AW-49H-1BV-300x300.jpg
"Reloj Casio Digital, Analógico Para Hombre Aw-48he",Casio Analógico-Digital,$32.00,https://timecenter.ec/wp-content/uploads/2018/01/618-copia-300x300.png
Reloj Casio Digital Para Hombre Db-36-1a,Casio Digital,$32.00,https://timecenter.ec/wp-content/uploads/2018/01/RELOJ-CASIO-DB-36-300x300.jpg
"Plancha Alisadora De Cabello Revlon Cerámica, 1-1 / 2 Pulgadas","Planchas de Cabello, Salud y Belleza",$31.99,https://timecenter.ec/wp-content/uploads/2018/02/Plancha-de-Cabello-RVST2181-300x300.jpg
"Cortadora de Cabello Wahl Color Code, 17 piezas 09155- 2708","Doméstico, Salud y Belleza",$31.99,https://timecenter.ec/wp-content/uploads/2021/03/09155-2708-300x300.jpg
Cepillo Alisador Remington Regulador De Temperatura Cb7482,"Cepillos, Salud y Belleza",$31.00,https://timecenter.ec/wp-content/uploads/2019/10/353-300x300.png
Reloj Casio Digital Para Hombre W-218H-1A,Casio Digital,$30.00,https://timecenter.ec/wp-content/uploads/2021/05/RELOJ-CASIO-41-300x300.jpg
Reloj Casio Digital Mujer W-215h-6AVDF,Casio Digital,$30.00,https://timecenter.ec/wp-content/uploads/2021/04/RELOJ-CASIO-MRW-200H-1-1-300x300.jpg
Reloj Casio Digital Para Hombre o Mujer W-215h 2AVDF,Casio Digital,$30.00,https://timecenter.ec/wp-content/uploads/2021/03/RELOJ-CASIO-W-215H-2AVDF-300x300.png
Micrófono Sony Dinámico F-V220 Sonido de precisión,"Audio y Video, Micrófono, Tecnología",$30.00,https://timecenter.ec/wp-content/uploads/2020/06/F-V220-300x300.jpg
Zapatos Deportivos West Original Para Niñ@ WST003B,Zapatos,$30.00$36.00,https://timecenter.ec/wp-content/uploads/2019/09/WST003B--300x300.jpg
Zapatos Deportivos West Original Para Niñ@ L18106DK,Zapatos,$30.00$38.00,https://timecenter.ec/wp-content/uploads/2019/09/L18106DK--300x300.jpg
Zapatos Deportivos West Original Para Niñ@ L18503BK,Zapatos,$30.00$38.00,https://timecenter.ec/wp-content/uploads/2019/09/L18503BK-300x300.jpg
Cartucho De Tinta HP 60 Negro,Cartuchos- Tintas,$30.00,https://timecenter.ec/wp-content/uploads/2019/09/HP-27-300x300.jpg
Zapatos Deportivos Rocker Para Niñ@ Blanco ROCKER02-N,Zapatos,$30.00$38.00,https://timecenter.ec/wp-content/uploads/2019/08/ROCKER02-N-1-300x300.jpg
Zapatos Deportivos Rocker Para Niñ@ Negro ROCKER02-N,Zapatos,$30.00$38.00,https://timecenter.ec/wp-content/uploads/2019/08/Negro-ROCKER02-N-300x300.jpg
Zapatos Deportivos West Original Color Menta RY0045DK,Zapatos,$30.00$38.00,https://timecenter.ec/wp-content/uploads/2019/07/RY0045DK-300x300.jpg
Zapatos Deportivos West Original Color Rosa RY0045BK,Zapatos,$30.00$38.00,https://timecenter.ec/wp-content/uploads/2019/07/RY0045DKcx-300x300.jpg
Reloj Casio Analógico Para Mujer LTP-V007L-9EUDF,Casio Analógico,$30.00,https://timecenter.ec/wp-content/uploads/2019/06/594-300x300.png
Reloj Casio Analógico Para Mujer Ltp-v007l-1eudf,Casio Analógico,$30.00,https://timecenter.ec/wp-content/uploads/2019/06/593-300x300.png
Reloj Casio Digital Para Hombre W-218H-2AVF,Casio Digital,$30.00,https://timecenter.ec/wp-content/uploads/2019/03/RELOJ-CASIO-W-218H-2AVF-300x300.jpg
Reloj Casio Analógico Para Mujer Ltp-v002l-1b,Casio Analógico,$30.00,https://timecenter.ec/wp-content/uploads/2018/09/580-300x300.png
Reloj Q&Q Analógico Para Mujer F519-202Y,QyQ Formal,$30.00,https://timecenter.ec/wp-content/uploads/2018/05/Reloj-QyQ-F519-202Y-300x300.jpg
Reloj Casio Analógico Para Hombre Mtp-v002l-1b,Casio Formal,$30.00,https://timecenter.ec/wp-content/uploads/2018/04/578-300x300.png
Cargador de Pilas Recargables GP 9V.,Cargadores de pilas,$30.00,https://timecenter.ec/wp-content/uploads/2018/02/Cargador-de-Baterías-9v-300x300.jpg
Reloj Casio Analógico Ltp-v001gl Mujer,Casio Formal,$28.00$30.00,https://timecenter.ec/wp-content/uploads/2018/02/relojj-casio-ltp-v-300x300.jpg
