Item,Category,Price,ImagenURL
Zapatos Deportivo EF1022,Zapatos,$68.00,https://timecenter.ec/wp-content/uploads/2020/09/EF1022-1-300x300.jpg
Zapatos Urbano Clásicos Reebok DV3840,Zapatos,$68.00,https://timecenter.ec/wp-content/uploads/2019/10/DV3840-300x300.jpg
Reloj Casio Digital Para Hombre Y Mujer A159wgea,Casio Formal,$68.00,https://timecenter.ec/wp-content/uploads/2019/05/75-1-300x300.png
Plancha De Cabello Babyliss Rápido 1″,"Planchas de Cabello, Salud y Belleza",$68.00,https://timecenter.ec/wp-content/uploads/2019/01/Captura-2-300x300.jpg
Reloj Casio Analógico Para  Mujer Ltp-1317d-7cdf,Casio Formal,$68.00,https://timecenter.ec/wp-content/uploads/2018/02/reloj-casio-LTP-1317D-7CDF-300x300.jpg
Reloj Casio Analógico Para Mujer Ltp-1332d-1adf,Casio Formal,$68.00,https://timecenter.ec/wp-content/uploads/2018/02/reloj-casio-LTP-1332D-1ADF-300x300.jpg
Reloj Casio Analógico Para Mujer Ltp-1340d,Casio Formal,$68.00,https://timecenter.ec/wp-content/uploads/2018/02/reloj-casio-LTP-1340D-1ADF-300x300.jpg
Reloj Casio Digital Para Hombre Y Mujer A159wgea-5d,Casio Formal,$67.00,https://timecenter.ec/wp-content/uploads/2019/10/6-300x300.jpg
Cepillo Y Secador Revlon De Cabello De Un Solo Paso Rvdr5212,"Cepillos, Salud y Belleza",$67.00,https://timecenter.ec/wp-content/uploads/2019/06/349-300x300.png
Cortadora De Cabello Wahl Profesional Magic Clip 5 Estrella,"Cortadoras de Cabello, Profesional, Salud y Belleza",$67.00$72.00,https://timecenter.ec/wp-content/uploads/2018/10/Magic-Clip-1-300x300.jpg
Cortadora de Cabello Wahl Profesional Super Taper,"Cortadoras de Cabello, Profesional, Salud y Belleza",$67.00,https://timecenter.ec/wp-content/uploads/2018/02/Cortadora-Wahl-supertaperc-1-1-1-300x300.jpg
Zapatos Deportivos Nike Hombre Correr BQ3201-001,Zapatos,$66.00,https://timecenter.ec/wp-content/uploads/2021/07/Nike-18-300x300.jpg
Zapatos Deportivos Nike Hombre SB Charge CD6279-003,Zapatos,,https://timecenter.ec/wp-content/uploads/2021/07/REEBOK-19-300x300.jpg
Zapatos Deportivos Nike Mujer WMNS NIKE TODOS BQ3201 100,Zapatos,$66.00,https://timecenter.ec/wp-content/uploads/2020/12/BQ3201-100-300x300.jpg
Zapatos Deportivos Nike Hombre Renew Ride Azul CD0311-400,Zapatos,$66.00,https://timecenter.ec/wp-content/uploads/2020/09/Zapatos-Nike-CD0311-400-300x300.jpg
"Zapatos Deportivos Nike Hombre Renew Arena 2, CD0311-002",Zapatos,$66.00,https://timecenter.ec/wp-content/uploads/2020/09/Zapatos-Nike-CD0311-002-300x300.jpg
Zapatos Urbano Clásicos Reebok Mujer DV7103,Zapatos,$66.00,https://timecenter.ec/wp-content/uploads/2020/06/DV7103-1-300x300.jpg
"Extractor De Jugo Echef, Boca Ancha, Motor de 700 Watts",Cocina,$66.00,https://timecenter.ec/wp-content/uploads/2018/05/extractor-echef-300x300.jpg
"Filmadora Portatil Para Auto, Coby Dchd101","Cámaras, Tecnología",$65.90,https://timecenter.ec/wp-content/uploads/2018/09/Captura55-300x300.png
Zapatos Deportivos Adidas Roguera EG2662,Zapatos,$65.00,https://timecenter.ec/wp-content/uploads/2021/08/ADIDAS-7-300x300.jpg
Zapatos Deportivos Adidas Roguera EG2657,Zapatos,$65.00,https://timecenter.ec/wp-content/uploads/2021/08/ADIDAS-9-300x300.jpg
Reloj Casio Analógico Para Mujer Ltp-1316d-1adf,Casio Formal,$65.00,https://timecenter.ec/wp-content/uploads/2019/06/647-300x300.png
Reloj Casio Digital Para Hombre y Mujer A-168wg-9wdf,Casio Formal,$65.00,https://timecenter.ec/wp-content/uploads/2019/03/323-300x300.jpg
"Teléfono Panasonic Inalámbrico KXTGC360LAB, Con contestador","Tecnología, Teléfono",$65.00,https://timecenter.ec/wp-content/uploads/2019/02/128-300x300.png
Máquina Cortadora De Pelo Wahl Para Mascotas U-clip 09281-2018,Máquinas Para Mascota,$64.99,https://timecenter.ec/wp-content/uploads/2020/12/Cortadora-Wahl-Combo-1-300x300.jpg
Peines Barbero Babyliss Pro Bbckt6 x30 unidades,"Cepillos, Para Detalles, Salud y Belleza",$64.40,https://timecenter.ec/wp-content/uploads/2019/05/20-3-300x300.png
Zapatos Deportivos Adidas Game Court FU8130,Zapatos,$64.00,https://timecenter.ec/wp-content/uploads/2021/08/ADIDAS-15-300x300.jpg
Zapatos Deportivos Adidas Correr RUNFALCON EG8602,Zapatos,$64.00,https://timecenter.ec/wp-content/uploads/2021/07/ADIDAS-3-300x300.jpg
Zapatos Deportivo Puma Interflex Modern 192805 12,Zapatos,$64.00,https://timecenter.ec/wp-content/uploads/2021/03/PUMA-31-300x300.jpg
Zapatos Deportivo Puma Interflex Runner 192567 12,Zapatos,$64.00,https://timecenter.ec/wp-content/uploads/2021/03/PUMA-28-300x300.jpg
Zapatos Puma ANZARUN LITE 371128 06,Zapatos,$64.00,https://timecenter.ec/wp-content/uploads/2020/10/371128-06-300x300.jpg
Cartucho De Tinta HP 954XL Negro,Cartuchos- Tintas,$64.00,https://timecenter.ec/wp-content/uploads/2020/06/HP-15-300x300.jpg
Cafetera 40 Tazas Black+Decker,"Cocina, Hogar",$64.00,https://timecenter.ec/wp-content/uploads/2018/07/percolador-300x300.jpg
Reloj Casio Digital Para Hombre Y Mujer A168WEC-3DF,Casio Formal,$63.00,https://timecenter.ec/wp-content/uploads/2021/04/RELOJ-CASIO-168WEC-3DF-300x300.jpg
Teléfono Panasonic Inalámbrico KX-TGB112LAB 2 auriculares,"Tecnología, Teléfono",$63.00,https://timecenter.ec/wp-content/uploads/2020/12/Telefono-Panasonic-KX-TGB210-1-300x300.jpg
Reloj Casio Digital Para Hombre Y Mujer A168wem-1d,Casio Formal,$63.00,https://timecenter.ec/wp-content/uploads/2019/07/840-300x300.png
Plancha de Cabello Remington S8598 Con Placas de Keratina y cerámica.,Planchas de Cabello,$62.00,https://timecenter.ec/wp-content/uploads/2021/05/Plancha-Remington-3-300x300.jpg
Olla de presión Oster 7 litros 4792,Cocina,$62.00,https://timecenter.ec/wp-content/uploads/2020/10/OLLA-PRESION-OSTER-7LT--300x300.jpg
Cortadora De Cabello Wahl Profesional Pro Basic 08256-008,"Cortadoras de Cabello, Profesional",$62.00,https://timecenter.ec/wp-content/uploads/2019/11/WAHL-PRO-300x300.jpg
Reloj Casio Con Calculadora Hombre Dbc-32d-1a,Casio Digital,$62.00,https://timecenter.ec/wp-content/uploads/2018/09/DFHDFGDFG-1-300x300.jpg
Cortadora de Cabello Wahl Profesional Designer 08358-208,"Cortadoras de Cabello, Profesional",$62.00,https://timecenter.ec/wp-content/uploads/2018/02/Cortadora-Wahl-Combo-Profesional-08358-208b-1-300x300.jpg
Patillera Wahl Profesional Peanut Poderoso Con Cordón 08655,"Patillera, Salud y Belleza",$61.90$65.00,https://timecenter.ec/wp-content/uploads/2018/06/Afeitadora-Wahl-08655-300x300.jpg
"Pinza para Ondular Cabello Babyliss Pro, con resorte, 3/4, BABNT75S","Pinzas Rizadoras, Salud y Belleza",$60.50,https://timecenter.ec/wp-content/uploads/2019/01/48-300x300.png
Zapatos Deportivos Adidas Lite Race Slip-On FX3793,Zapatos,$60.00,https://timecenter.ec/wp-content/uploads/2021/08/ADIDAS-25-300x300.jpg
Zapatos Deportivo Puma Mujer Vikky V2 369725 18,Zapatos,$60.00,https://timecenter.ec/wp-content/uploads/2021/08/PUMA-10-300x300.jpg
Zapatos Deportivo Puma Hombre Dc Future 373022 04,Zapatos,$60.00,https://timecenter.ec/wp-content/uploads/2021/08/PUMA-38-300x300.jpg
Zapatos Deportivo Puma Hombre DC Future,Zapatos,$60.00,https://timecenter.ec/wp-content/uploads/2021/08/PUMA-32-2-300x300.jpg
Zapatos Deportivo Puma Hombre Wired Run 373200-02 Correr,Zapatos,$60.00,https://timecenter.ec/wp-content/uploads/2021/08/PUMA-32-1-1-300x300.jpg
Zapatos Deportivo Puma Hombre R78 Modelo 374127 02,Zapatos,$60.00,https://timecenter.ec/wp-content/uploads/2021/08/PUMA-6-300x300.jpg
Zapatos Deportivo Puma Hombre Comet 194272 04,Zapatos,$60.00,https://timecenter.ec/wp-content/uploads/2021/08/PUMA-32-300x300.jpg
Zapatos Deportivos Reebok Hombre FX9157,Zapatos,$60.00,https://timecenter.ec/wp-content/uploads/2021/06/REEBOK-11-1-300x300.jpg
Reloj Casio Analógico Para Mujer LTP-E165D,Casio Formal,$60.00,https://timecenter.ec/wp-content/uploads/2021/05/RELOJ-CASIO-8-300x300.jpg
Zapatos Deportivos Reebok Flexagon Force EH3553,Zapatos,$60.00,https://timecenter.ec/wp-content/uploads/2021/02/REEBOK-3-300x300.jpg
"Reloj Casio Analógico, Multifunción Para Mujer Lrw-250h-9",Casio Analógico,$60.00,https://timecenter.ec/wp-content/uploads/2019/08/942-300x300.png
"Pinza para cabello babyliss,con resort,pinza 1″","Pinzas Rizadoras, Salud y Belleza",$60.00,https://timecenter.ec/wp-content/uploads/2018/06/Churero-Babyliss-BABNT100S-300x300.jpg
Reloj Casio Analógico Para Mujer Ltp-1346d-4cdf,Casio Formal,$60.00,https://timecenter.ec/wp-content/uploads/2018/02/reloj-casio-LTP-1346D-4CDF-300x300.jpg
"Silla Xtech para Escritorio con Descansabrazos Azul, AM160GEN79",Accesorio de Computación,$59.99,https://timecenter.ec/wp-content/uploads/2020/11/SILLA-AM160GEN79-1-300x300.jpg
Reloj Casio Analógico Para Hombre Mcw100h-1a2v,Casio Analógico,$59.99$82.00,https://timecenter.ec/wp-content/uploads/2019/06/519-300x300.png
Lector Escáner de Código de Barras Custom,Tecnología,$59.00,https://timecenter.ec/wp-content/uploads/2021/03/pistola-300x300.jpg
Audífono inalámbricos con Bluetooth 4.0  JBL T450BT,"Audífonos, Bluetooth",$59.00,https://timecenter.ec/wp-content/uploads/2020/08/T450BT-300x300.jpg
"Reloj Casio con Calculadora, Hombre Ca-506C-5ADF",Casio Formal,$59.00$87.00,https://timecenter.ec/wp-content/uploads/2018/02/RELOJ-CASIO-CA-506G-9A-300x300.jpg
"Reloj Casio con Calculadora, Hombre Ca-506B-1ADF",Casio Formal,$59.00$87.00,https://timecenter.ec/wp-content/uploads/2018/02/RELOJ-CASIO-CA-506B-1A-300x300.jpg
"Reloj Casio Deportivo MRW-s300h-1BVDF, SOLAR",Casio Analógico,$59.00$79.00,https://timecenter.ec/wp-content/uploads/2020/06/mrw-s300h-1bvdf-300x300.jpg
"Reloj Casio Analógico, Solar, Para Hombre Mrw-s300h-1b3vdf",Casio Analógico,$59.00$79.00,https://timecenter.ec/wp-content/uploads/2020/06/MRW-S300H-1B3VDF-300x300.jpg
"Reloj Casio con Calculadora, Hombre Ca-506C-5A",Casio Digital,$59.00$87.00,https://timecenter.ec/wp-content/uploads/2018/02/RELOJ-CASIO-CA-506C-5A-300x300.jpg
Aspiradora Electrolux 2-en-1 1000W STK12,Aspiradoras,$58.99$69.00,https://timecenter.ec/wp-content/uploads/2021/04/STK12-1-300x300.jpg
Repetidor Nexxt Extensor Wifi Sparx201-w Amplifica Wireles,"Accesorio de Computación, Reguladores de Voltaje",$58.99,https://timecenter.ec/wp-content/uploads/2020/08/NEXXT-201-300x300.jpg
Olla Arrocera Electrolux 10 Tazas Ecc20,"Cocina, Hogar",$58.95,https://timecenter.ec/wp-content/uploads/2019/11/6-1-300x300.jpg
"Reloj Casio Digital, Analógico, Hora Mundial Para Hombre AEQ-110W-1AVDF",Casio Analógico-Digital,$58.00,https://timecenter.ec/wp-content/uploads/2021/05/Reloj-Casio-AEQ-110-300x300.jpg
"Plancha Alisadora de Cabello Revlon Salon XL de 1 ½ ”, 455°F","Planchas de Cabello, Salud y Belleza",$58.00,https://timecenter.ec/wp-content/uploads/2021/04/Plancha-de-Cabello-RVST2184-1-300x300.jpg
Zapatos Deportivos Reebok CN7866,Zapatos,$58.00,https://timecenter.ec/wp-content/uploads/2019/10/CN7866-300x300.jpg
Reloj Casio Analógico Para Mujer Ltp-1291d-4avdf,Casio Formal,$58.00,https://timecenter.ec/wp-content/uploads/2019/06/663-300x300.png
"Reloj Casio Digital, Analógico, Hora Mundial, Para Hombre AEQ-100BW-9AVDF",Casio Analógico-Digital,$58.00$68.00,https://timecenter.ec/wp-content/uploads/2019/06/394-300x300.png
"Reloj Casio Digital, Analógico, Hora Mundial, Para Hombre AEQ-100W-1AVDF",Casio Analógico-Digital,$58.00$68.00,https://timecenter.ec/wp-content/uploads/2019/06/398-1-300x300.png
"Reloj Casio Digital, Analógico, Hora Mundial, Para Hombre AEQ-100W-1BV",Casio Analógico-Digital,$58.00$68.00,https://timecenter.ec/wp-content/uploads/2019/06/399-300x300.png
Zapatos Deportivos Fútbol Adidas NEMEZIZ 19.4 PASTO SINTÉTICO FV3317,Zapatos,$57.00,https://timecenter.ec/wp-content/uploads/2021/07/ADIDAS-4-1-300x300.jpg
UPS 600va 360w Marca Anera,Reguladores de Voltaje,$56.00,https://timecenter.ec/wp-content/uploads/2021/01/UPS-300x300.jpg
Máquina Cortadora De Pelo Wahl Para Mascotas Basic Dog Grooming 09160-2308,Máquinas Para Mascota,$55.99,https://timecenter.ec/wp-content/uploads/2020/12/Cortadora-Wahl-Combo-3-300x300.jpg
Reloj Casio Para Hombre MTP-1235SG-7ADF,Casio Formal,$55.00,https://timecenter.ec/wp-content/uploads/2021/02/CASIO-9-300x300.jpg
Zapatos Puma ST ACTIVATE 369122 03,Zapatos,$55.00,https://timecenter.ec/wp-content/uploads/2020/10/369122-03-300x300.jpg
Zapatos Puma Urbano Para Hombre  pre Jogger SL 370305 02,Zapatos,$55.00,https://timecenter.ec/wp-content/uploads/2020/09/ZAPATOS-PUMA-PURE-JO-7-370305-2-300x300.jpg
Secador de Cabello Revlon Pro Rvdr5105 Collection Salon,"Salud y Belleza, Secadoras de Cabello",$55.00,https://timecenter.ec/wp-content/uploads/2020/06/RVDR5105-300x300.jpg
Reloj Casio Analógico Para Mujer LTP-1378L-1EDF,Casio Formal,$55.00,https://timecenter.ec/wp-content/uploads/2019/06/748-3-300x300.png
Calculadora Financiera Casio FC-100,Calculadora,$55.00$59.00,https://timecenter.ec/wp-content/uploads/2018/01/Calculadora-Casio-FC100V-1-300x300.jpg
Batidora De Pedestal 5 V Electrolux Esm30,Cocina,$54.95$62.00,https://timecenter.ec/wp-content/uploads/2020/07/BATERIA-ELECTROLUX-300x300.jpg
Zapatos Deportivos Reebok Hombre FY7956,Zapatos,$54.00,https://timecenter.ec/wp-content/uploads/2021/06/REEBOK-10-300x300.jpg
Plancha Cabello Remington Ultimate Cerámica Straightener S6500,Planchas de Cabello,$54.00,https://timecenter.ec/wp-content/uploads/2021/05/s6500-1-300x300.jpg
Zapatos Deportivos Reebok Advanced Trainette FV4668 Entrenamiento para Mujer,Zapatos,$54.00,https://timecenter.ec/wp-content/uploads/2021/02/REEBOK-4-1-300x300.jpg
Audífono inalámbricos con Bluetooth  JBL T450BT,"Audífonos, Bluetooth",$54.00,https://timecenter.ec/wp-content/uploads/2020/09/JBLT500-blanco-300x300.jpg
Zapatos Deportivos Reebok FV0287,Zapatos,$54.00,https://timecenter.ec/wp-content/uploads/2020/06/FV0287-2-300x300.jpg
Zapatos Deportivos Reebok DV9762,Zapatos,$54.00,https://timecenter.ec/wp-content/uploads/2020/01/DV9762-1-300x300.jpg
"Reloj Casio Digital, Analógico Para Hombre  Aw-80D-1A",Casio Analógico-Digital,$54.00,https://timecenter.ec/wp-content/uploads/2018/01/Reloj-Casio-AW-80D-300x300.jpg
Teclado Microsoft Ergonómico Natural 4000 105 Teclas,Teclado,$53.00$69.00,https://timecenter.ec/wp-content/uploads/2018/11/microsof-300x300.jpg
Mouse Inalambrico Trackman Logitech M570,Mouse,$52.99$59.00,https://timecenter.ec/wp-content/uploads/2020/06/Mouse-Inalambrico-Ligitech-M170-t-300x300.jpg
Cafetera Echef Pro 60 Tazas Perocolador Electrico Dk-60,Cocina,$52.99,https://timecenter.ec/wp-content/uploads/2019/11/Cafetera-Echef-dk60-a-300x300.jpg
"Teléfono Panasonic Inalámbrico Kx-tgc350 Con Altavoz, ID","Tecnología, Teléfono",$52.99,https://timecenter.ec/wp-content/uploads/2018/05/p1-9-300x300.jpg
Plancha Alisadora y Cepillo 2 en 1  Revlon RVST-2200,"Cepillos, Pinzas Rizadoras, Planchas de Cabello, Salud y Belleza",$52.00,https://timecenter.ec/wp-content/uploads/2021/08/CEPILLO-13-1-300x300.jpg
Cocina Eléctrica Elite Cuisine 2 EN 1 EDB302SS,Cocina,$52.00,https://timecenter.ec/wp-content/uploads/2021/06/cocina-2-300x300.jpg
Reloj Casio Analógico Para Hombre Mtp-1131g-7ardf,Casio Formal,$52.00,https://timecenter.ec/wp-content/uploads/2019/03/417-300x300.png
"Reloj Casio Digital, Hora Mundial, Para Hombre Ae-1100wd-1avdf",Casio Digital,$52.00,https://timecenter.ec/wp-content/uploads/2019/03/624-6-300x300.png
"Reloj Casio Con Calculadora, Hombre Dbc-32-1a",Casio Digital,$52.00$67.00,https://timecenter.ec/wp-content/uploads/2018/01/37-1-17-1-300x300.jpg
Reloj Casio Digital Para Hombre W-740-1v,Casio Digital,$52.00,https://timecenter.ec/wp-content/uploads/2018/01/RELOJ-CASIO-W-740-300x300.jpg
Teclado + Mouse Microsoft  Wireless Español,"Mouse, Teclado",$51.50,https://timecenter.ec/wp-content/uploads/2020/06/microsof-1-2-300x300.jpg
Reloj Casio Digital A-159WAD-1D,Casio Digital,$50.50,https://timecenter.ec/wp-content/uploads/2021/05/Reloj-Casio-a-159-300x300.jpg
Secador Cabello Babyliss Cerámica Xtreme Profesional Rojo,"Salud y Belleza, Secadoras de Cabello",$50.50,https://timecenter.ec/wp-content/uploads/2018/11/Secador-de-Cabello-Babyliss-babr5572-a-300x300.jpg
Zapatos Deportivo Puma Niño Scuderia Ferrari Race R Cat 306546 01,Zapatos,$50.00,https://timecenter.ec/wp-content/uploads/2021/08/PUMA-5-300x300.jpg
Zapatos Deportivo Puma Hombre BMW MMS R-CAT 306531 02,Zapatos,$50.00,https://timecenter.ec/wp-content/uploads/2021/08/PUMA-3-300x300.jpg
Zapatos Deportivos Fútbol Adidas PREDATOR 20.4 S pasto sintético EE9584,Zapatos,$50.00,https://timecenter.ec/wp-content/uploads/2021/07/ADIDAS-1-300x300.jpg
Zapatos Deportivos Reebok Hombre Lite Plus 2 FW8332 Correr,Zapatos,$50.00,https://timecenter.ec/wp-content/uploads/2021/06/REEBOK-11-2-300x300.jpg
"Zapatos Deportivos Reebok Mujer Runaround para caminar, FU8947",Zapatos,$50.00$79.90,https://timecenter.ec/wp-content/uploads/2021/06/REEBOK-14-300x300.jpg
Reloj Casio Digital Vintange La 670wem 7d. Vintage Retro,Casio Digital,$50.00,https://timecenter.ec/wp-content/uploads/2021/05/RELOJ-CASIO-LA-670-300x300.jpg
Zapatos Deportivos Reebok DV5714,Zapatos,$50.00,https://timecenter.ec/wp-content/uploads/2020/07/DV5714-2-300x300.jpg
"Zapatos Deportivos Reebok Energyl DV6485, para Correr",Zapatos,$50.00,https://timecenter.ec/wp-content/uploads/2020/06/DV6485-1-300x300.jpg
Zapatos Deportivos Reebok Royal CM9542,Zapatos,$50.00,https://timecenter.ec/wp-content/uploads/2020/06/CM9542-1-300x300.jpg
Zapatos Deportivos Reebok BS7173,Zapatos,$50.00,https://timecenter.ec/wp-content/uploads/2020/06/BS7173-1-300x300.jpg
Zapatos Deportivos Reebok DV5715,Zapatos,$50.00,https://timecenter.ec/wp-content/uploads/2020/01/150-1-300x300.jpg
Grabadora De Voz Digital Coby 4gb,"Grabadoras de Voz, Tecnología",$50.00,https://timecenter.ec/wp-content/uploads/2018/10/Grabadora-de-voz-Coby-CVR-25-B-300x300.png
Aspiradora Inalámbrica de Mano,Aspiradoras,$49.99,https://timecenter.ec/wp-content/uploads/2021/06/Aspiradora-1-300x300.jpg
Cartucho De Tinta HP 122XL,Cartuchos- Tintas,$49.50,https://timecenter.ec/wp-content/uploads/2019/09/HP-19-300x300.jpg
Reloj Casio Analógico Para Hombre Mtp-v002g-1b,Casio Formal,$49.00,https://timecenter.ec/wp-content/uploads/2021/05/RELOJ-CASIO-30-300x300.jpg
Reloj Casio Analógico Para Mujer Ltp-V004L 1BUDF,Casio Formal,$49.00,https://timecenter.ec/wp-content/uploads/2019/06/570-300x300.png
Set De 7 Cepillos Termicos Babyliss Nano Titanium Profesional,"Cepillos, Salud y Belleza",$49.00,https://timecenter.ec/wp-content/uploads/2018/09/Captura14-1-300x300.png
Reloj QyQ Analógico Para Hombre Da52j512y,QyQ Deportivo,$49.00,https://timecenter.ec/wp-content/uploads/2018/05/244-300x300.jpg
Reloj Casio Analógico Para Hombre MTP-V002G-1B2,Casio Formal,$49.00,https://timecenter.ec/wp-content/uploads/2018/04/RELOJ-CASIO-29-300x300.jpg
Cortadora de Cabello Wahl  Combo Cut con afeitadora de nariz,"Cortadoras de Cabello, Doméstico, Salud y Belleza",$49.00,https://timecenter.ec/wp-content/uploads/2018/03/WHAL-COMBO-CUT-1-300x300.jpg
Secador de cabello Revlon  con herramientas 3 en 1 RVDR-5225,Secadoras de Cabello,$48.99,https://timecenter.ec/wp-content/uploads/2021/08/m1505-1-300x300.jpg
Router Nexxt Inalámbrico-AC de Doble Banda 1200Mbps Nebula1200-AC,"Accesorio de Computación, Reguladores de Voltaje",$48.99,https://timecenter.ec/wp-content/uploads/2021/01/NEXXT-5-300x300.jpg
Aspiradora Electrolux Vertical 3 En 1 600w Stk10,"Aspiradoras, Hogar",$48.99,https://timecenter.ec/wp-content/uploads/2019/11/35-300x300.jpg
Afeitadora Wahl con cable 09699-101,"Afeitadoras, Salud y Belleza",$48.60,https://timecenter.ec/wp-content/uploads/2018/03/WHAL-HAIRCUT-300x300.jpg
Reloj Casio Digital Para Hombre AE-1400WH-9AVDDF,Casio Digital,$48.00,https://timecenter.ec/wp-content/uploads/2021/04/RELOJ-CASIO-AE-1400WH-300x300.jpg
Reloj Casio Para Hombre MTP-1165A-1C2,Casio Formal,$48.00,https://timecenter.ec/wp-content/uploads/2021/02/CASIO-15-300x300.jpg
Reloj Casio Para Hombre MTP-1165A-7C2DF,Casio Formal,$48.00,https://timecenter.ec/wp-content/uploads/2021/02/CASIO-12-300x300.jpg
Zapatos Urbano de Cuero para Hombre 780 Azul Relax,Zapatos,$48.00,https://timecenter.ec/wp-content/uploads/2020/10/780-AZUL-300x300.jpg
Zapatos Urbano de Cuero para Hombre 780 Negro Relax,Zapatos,$48.00,https://timecenter.ec/wp-content/uploads/2020/10/780-NEGRO-300x300.jpg
Zapatos Urbano de Cuero para Hombre 767 Café Ensueño,Zapatos,$48.00,https://timecenter.ec/wp-content/uploads/2020/10/767-CAFE-1-300x300.jpg
Zapatos Urbano de Cuero para Hombre 767 Azul Relax,Zapatos,$48.00,https://timecenter.ec/wp-content/uploads/2020/10/767-AZUL-300x300.jpg
Zapatos Urbano de Cuero para Hombre 768 Café Relax,Zapatos,$48.00,https://timecenter.ec/wp-content/uploads/2020/10/768-WISKY-300x300.jpg
Zapatos Urbano de Cuero para Hombre 768 Wisky Ensueño,Zapatos,$48.00,https://timecenter.ec/wp-content/uploads/2020/10/768-CAFE-300x300.jpg
Zapatos Urbano de Cuero para Hombre 768 Negro Relax,Zapatos,$48.00,https://timecenter.ec/wp-content/uploads/2020/10/768-NEGRO-300x300.jpg
Zapatos Urbano de Cuero para Hombre 769 Café Relax,Zapatos,$48.00,https://timecenter.ec/wp-content/uploads/2020/10/769-WISKY-300x300.jpg
Zapatos Urbano de Cuero para Hombre 769 Café Ensueño,Zapatos,$48.00,https://timecenter.ec/wp-content/uploads/2020/10/769-CAFE-300x300.jpg
Zapatos Urbano de Cuero para Hombre 769 Negro Napa,Zapatos,$48.00,https://timecenter.ec/wp-content/uploads/2020/10/769-NEGRO-300x300.jpg
Disco Solido Ssd Kingston De 240gb Sa400s37/240g,"Memorias, Tecnología",$48.00,https://timecenter.ec/wp-content/uploads/2019/10/66-300x300.jpg
Reloj QyQ Analógico Para Hombre Da40j502y,QyQ Deportivo,$48.00,https://timecenter.ec/wp-content/uploads/2019/09/345-300x300.jpg
Reloj QyQ Analógico Para Hombre Da34j304y,QyQ Deportivo,$48.00,https://timecenter.ec/wp-content/uploads/2019/09/317-300x300.jpg
"Reloj QyQ Analógico, Multifunción Para Hombre Da86j002y",QyQ Deportivo,$48.00,https://timecenter.ec/wp-content/uploads/2019/09/248-300x300.jpg
Cortadora De Cabello Wahl Deluxe Groom Pro 79305-3608,Doméstico,$48.00,https://timecenter.ec/wp-content/uploads/2019/07/Cortadora-De-Cabello-Wahl-Deluxe-Groom-Pro-79305-3608--300x300.jpg
Reloj Casio Analógico Para Mujer Ltp-1293d-3adf,Casio Formal,$48.00,https://timecenter.ec/wp-content/uploads/2019/03/411-300x300.jpg
Olla Arrocera 1.2 Litros Color Blanca. 4728-12,"Cocina, Hogar",$48.00,https://timecenter.ec/wp-content/uploads/2018/07/oster-larrocers-300x300.jpg
Tenaza Pinza Churero Babyliss  Cónica de Risos Nano Titanio,"Pinzas Rizadoras, Salud y Belleza",$48.00,https://timecenter.ec/wp-content/uploads/2018/02/Pinza-Babyliss-Pro-300x300.jpeg
"Reloj QyQ Analógico, Multifunción Para Hombre DA86J003Y",QyQ Deportivo,$48.00,https://timecenter.ec/wp-content/uploads/2018/01/Reloj-QyQ-DA86J003Y-300x300.png
Teléfono Panasonic Inalámbrico KXTGB310,Teléfono,$47.00,https://timecenter.ec/wp-content/uploads/2021/05/Panasonic-300x300.jpg
Teléfono Panasonic Inalámbrico KXTGB310,Teléfono,$47.00,https://timecenter.ec/wp-content/uploads/2021/05/KXTGB310-300x300.jpg
Cartucho De Tinta HP 954XL Cyan,Cartuchos- Tintas,$47.00,https://timecenter.ec/wp-content/uploads/2020/06/HP-16-300x300.jpg
Cartucho De Tinta HP 954XL Mangenta,Cartuchos- Tintas,$47.00,https://timecenter.ec/wp-content/uploads/2020/06/HP-18-300x300.jpg
"Cartucho De Tinta HP 954XL, Amarento",Cartuchos- Tintas,$47.00,https://timecenter.ec/wp-content/uploads/2019/07/HP-17-300x300.jpg
Reloj Casio Analógico Para Hombre Mtp-1233d,Casio Formal,$47.00,https://timecenter.ec/wp-content/uploads/2019/05/423-1-300x300.jpg
Reloj Casio Analógico Para Hombre Mtp-vd01d-7bvudf,Casio Formal,$47.00,https://timecenter.ec/wp-content/uploads/2019/03/591-1-300x300.png
Calculadora De Impresora Casio  Hr-100RC,Calculadora,$47.00,https://timecenter.ec/wp-content/uploads/2019/02/HR-100RC--300x300.jpg
"Reloj Casio Digital, Hora Mundial, Para Hombre Ae-1000wd-1av",Casio Digital,$47.00,https://timecenter.ec/wp-content/uploads/2018/04/621-4-300x300.png
Maquina Lápiz Profesional Wahl Tattoo Diseños En El Cabello Artist,"Cortadoras de Cabello, Para Detalles, Salud y Belleza",$47.00,https://timecenter.ec/wp-content/uploads/2018/03/WAHL-ARTIST-300x300.jpg
"Reloj Casio Digital, Alarma Con Vibrador Para Hombre W-735H-5AV",Casio Digital,$46.90$55.00,https://timecenter.ec/wp-content/uploads/2021/04/RELOJ-CASIO-W-735H-5AV-1-300x300.jpg
"Reloj Casio Digital, Alarma Con Vibrador Para Hombre W-735H-2AV",Casio Digital,$46.90$55.00,https://timecenter.ec/wp-content/uploads/2020/07/W-735H-2AV-300x300.jpg
"Reloj Casio Digital, Alarma Con Vibraciones Para Hombre W-735H- 8A2DF",Casio Digital,$46.90$55.00,https://timecenter.ec/wp-content/uploads/2018/01/617-copia-1-300x300.png
Zapatos Deportivos Reebok DV9600,Zapatos,$46.00,https://timecenter.ec/wp-content/uploads/2020/06/DV9600-1-300x300.jpg
Reloj Casio Analógico Para Mujer Ltp-1128g-7b,Casio Formal,$46.00,https://timecenter.ec/wp-content/uploads/2018/01/reloj-casioltp-1128g-300x300.jpg
"Reloj Casio Con Calculadora, Hombre Ca-506-1",Casio Digital,$46.00,https://timecenter.ec/wp-content/uploads/2018/01/RELOJ-CASIO-C506-300x300.jpg
"Reloj Casio Digital, Analógico Para Hombre  Aw-80V-1BVDF",Casio Analógico-Digital,$45.00,https://timecenter.ec/wp-content/uploads/2021/04/reloj-casio-aw-80-300x300.jpg
Reloj Casio Digital Tough Solar W-753-1AVDF,Casio Digital,$45.00,https://timecenter.ec/wp-content/uploads/2021/04/RELOJ-CASIO-W-753-1AVDF-300x300.jpg
Reloj Casio Digital W-753,Casio Digital,$45.00,https://timecenter.ec/wp-content/uploads/2021/04/RELOJ-CASIO-w-753-300x300.jpg
Zapatos deportivo Umbro Hombre Tomber 20103040-019,Zapatos,$45.00,https://timecenter.ec/wp-content/uploads/2021/03/UMBRO-17-300x300.jpg
Zapatos deportivo Umbro Hombre Tomber 20103040-029,Zapatos,$45.00,https://timecenter.ec/wp-content/uploads/2021/03/UMBRO-13-1-300x300.jpg
Teléfono Uniden Inalámbrico 2 Auriculares AT31012,Teléfono,$45.00,https://timecenter.ec/wp-content/uploads/2020/12/Captura-3-300x300.jpg
Impresora Hp Multifunción Desket Ink Advantage 2375,Impresoras,$45.00,https://timecenter.ec/wp-content/uploads/2019/06/HP-25-300x300.jpg
Reloj Casio Analógico Para Mujer LTP-1237D-1A2DF,Casio Formal,$45.00,https://timecenter.ec/wp-content/uploads/2020/07/LTP-1237D-1A2DF-300x300.jpg
