Item,Category,Price,ImagenURL
Router Inalámbrico-N 300Mbps Nyx300,"Accesorio de Computación, Reguladores de Voltaje",$18.75,https://timecenter.ec/wp-content/uploads/2021/01/NEXXT-11-300x300.jpg
Calculadora Cientifica Casio FX-82LA X,Calculadora,$18.50,https://timecenter.ec/wp-content/uploads/2020/03/FX-82LA-X-BK-300x300.jpg
Calculadora Cientifica Casio FX-82LA X,Calculadora,$18.50,https://timecenter.ec/wp-content/uploads/2020/03/FX-82LA-X-PK-300x300.jpg
Cartucho De Tinta Hp 122 Negro,Cartuchos- Tintas,$18.50,https://timecenter.ec/wp-content/uploads/2019/07/HP-5-300x300.jpg
Calculadora Cientifica Casio FX-82LA X,Calculadora,$18.50,https://timecenter.ec/wp-content/uploads/2018/01/FX-82LA-X-BU-2-300x300.jpg
Remachadora de PLUG de Teléfono KIT 3 Piezas,Electrónica,$18.25,https://timecenter.ec/wp-content/uploads/2020/12/REMACHADORA-PLUG-TELF-3P-300x300.jpg
Cargador De Pilas Recargables Sony Bcg34hw2gn,Cargadores de pilas,$18.25,https://timecenter.ec/wp-content/uploads/2019/08/1-1-300x300.png
Cargador de Pilas Recargables Energizer Maxi,Cargadores de pilas,$18.22,https://timecenter.ec/wp-content/uploads/2018/02/cargador-energizer-maxi-300x300.jpg
Plancha Mini De Cabello Remington S2880C Cerámica,Planchas de Cabello,$18.00,https://timecenter.ec/wp-content/uploads/2021/05/765-3-300x300.jpg
Reloj Casio Analógico MQ-76-2,Casio Analógico,$18.00,https://timecenter.ec/wp-content/uploads/2021/04/RELOJ-CASIO-MQ-76-2-300x300.jpg
Reloj Casio Analógico MQ-24-9B3LCK,Casio Analógico,$18.00,https://timecenter.ec/wp-content/uploads/2021/04/RELOJ-CASIO-MQ-24-9B3LCK-300x300.jpg
Reloj Casio Analógico MQ-24-1B3LDF,Casio Analógico,$18.00,https://timecenter.ec/wp-content/uploads/2019/03/RELOJ-CASIO-MQ-24-1B3LDF-300x300.jpg
Reloj Casio Analógico LQ-142E-9ADF,Casio Analógico,$18.00,https://timecenter.ec/wp-content/uploads/2021/04/RELOJ-CASIO-LQ-142E-9ADF-300x300.jpg
Reloj Casio Analógico MQ-38-9ADF,Casio Analógico,$18.00,https://timecenter.ec/wp-content/uploads/2021/04/RELOJ-CASIO-MQ-38-9ADF-300x300.jpg
Reloj Casio Analógico Para Hombre MQ-27-1BDF,Casio Analógico,$18.00,https://timecenter.ec/wp-content/uploads/2021/04/RELOJ-CASIO-MQ-27-1BDF-300x300.jpg
Reloj Casio Analógico Para Hombre MQ-27-7BDF,Casio Analógico,$18.00,https://timecenter.ec/wp-content/uploads/2021/04/RELOJ-CASIO-MQ-27-7BDF-300x300.jpg
Reloj Casio Analógico Para Hombre Mq-71-4B,Casio Analógico,$18.00,https://timecenter.ec/wp-content/uploads/2021/02/RELOJ-CASIO-MQ-71-4B-300x300.jpg
Reloj Coby Despertador Con Proyector Cbc-54,Despertador,$18.00,https://timecenter.ec/wp-content/uploads/2019/10/1-300x300.png
Reloj Q&Q Analógico Para Hombre Vr10j010y,QyQ Deportivo,$18.00,https://timecenter.ec/wp-content/uploads/2019/09/378-300x300.jpg
Reloj Q&Q Analógico Para Hombre Y Mujer Vp84j006y,QyQ Deportivo,$18.00,https://timecenter.ec/wp-content/uploads/2019/09/356-300x300.jpg
"Juego De 3 Cepillos Profesional, Bolso Babyliss Babybrbg1","Cepillos, Salud y Belleza",$18.00,https://timecenter.ec/wp-content/uploads/2019/05/35-3-300x300.png
Reloj Casio Analógico Para Hombre MQ-27-7BDF,Casio Analógico,$18.00,https://timecenter.ec/wp-content/uploads/2019/03/383-300x300.jpg
Reloj Casio Analógico MW-59-1ELCK,Casio Analógico,$18.00,https://timecenter.ec/wp-content/uploads/2019/03/RELOJ-CASIO-MW-59-1ELCK-300x300.jpg
Reloj Casio Analógico Para Hombre Mq-71-2B,Casio Analógico,$18.00,https://timecenter.ec/wp-content/uploads/2018/02/RELOJ-CASIO-MQ-71-2B-300x300.jpg
Mouse Inalambrico Genius Micro Traveler 900s,Mouse,$17.95,https://timecenter.ec/wp-content/uploads/2020/06/MICRO-TRAVELER-900S-300x300.jpg
Micrófono Philips Con Cable De 5m Sbcmd19500,"Audio y Video, Micrófono, Tecnología",$17.80,https://timecenter.ec/wp-content/uploads/2019/10/PHILIPSMD195-300x300.jpg
"Cepillo De Pelo Wahl Para Mascotas doble cara con rastrillo, dos filas",Máquinas Para Mascota,$17.75,https://timecenter.ec/wp-content/uploads/2021/06/cepillo-7-300x300.jpg
Teclado Logitech Inalambrico Compacto MK230,Teclado,$17.50,https://timecenter.ec/wp-content/uploads/2020/09/K230-300x300.jpg
Reloj Q&Q Analógico Para Hombre Q840j211y,QyQ Formal,$17.50,https://timecenter.ec/wp-content/uploads/2019/09/220-300x300.jpg
Reloj Q&Q Analógico Para Hombre Q882j202y,QyQ Formal,$17.50,https://timecenter.ec/wp-content/uploads/2019/09/198-300x300.png
Reloj Q&Q Analógico Para Hombre Q686j204y,QyQ Formal,$17.50,https://timecenter.ec/wp-content/uploads/2019/09/193-300x300.png
Reloj Q&Q Analógico Para Mujer F325-001,QyQ Formal,$17.50,https://timecenter.ec/wp-content/uploads/2019/09/194-300x300.png
Reloj Q&Q Analógico Para Mujer F339-002,QyQ Formal,$17.50,https://timecenter.ec/wp-content/uploads/2019/09/185-300x300.png
Mouse Ergonómico Inalámbrico Klipxtreme con seis botones,"Mouse, Tecnología",$17.50,https://timecenter.ec/wp-content/uploads/2019/07/KBK-500BK-300x300.jpg
Cable Extension Usb Anera 15metros con Amplificación,"Cables, Tecnología",$17.50,https://timecenter.ec/wp-content/uploads/2018/07/CABLE-extencion-usb-300x300.jpg
Telefono Alcatel Alámbrico T22,"Tecnología, Teléfono",$17.50,https://timecenter.ec/wp-content/uploads/2019/01/Teléfono-Alcatel-T22-300x300.jpg
Combo Teclado Wireless-mouse Negro Ae-kbmr01-b,"Mouse, Teclado",$17.50,https://timecenter.ec/wp-content/uploads/2018/05/Teclado-y-Mouse-Anera-inalambrico-300x300.jpg
"HUB USB 3.O Anera, 7 Puertos, AE-USB3.0H701P",Cables,$17.00,https://timecenter.ec/wp-content/uploads/2020/10/Multi-7-puertos-USB-HUB-3-0-supervelocidad-5Gbps-Mini-USB-3-0-HUB-USB-Splitter-3-300x300.jpg
Tripode Vivitar Para Cámara De Fotos 50 pulgadas,Cámaras,$17.00,https://timecenter.ec/wp-content/uploads/2020/06/TRIPODE-VPT-1252-3-copia-300x300.jpg
Reloj Q&Q Analógico Para Hombre Vr62j003y,"Relojería, Relojes",$17.00,https://timecenter.ec/wp-content/uploads/2018/05/RELOJ-QYQ-VR62J003Y-300x300.jpg
"Accesorio Para Licuadora Oster Mini Vaso Mescla, Muele, BLSTMJ-50-011",Cocina,$16.90,https://timecenter.ec/wp-content/uploads/2021/01/PLANTILLA-27-300x300.jpg
"Teléfono Uniden Alámbrico AT6410, Con Altavoz",Teléfono,$16.75,https://timecenter.ec/wp-content/uploads/2020/12/Captura-7-300x300.jpg
"Parlante Bluetooth Coby,  Resistente Al Agua",Bluetooth,$16.55,https://timecenter.ec/wp-content/uploads/2018/02/Parlante-Coby-300x300.jpg
Regulador De Voltaje Anera de 1200va,Reguladores de Voltaje,$16.50,https://timecenter.ec/wp-content/uploads/2021/06/REGULADOR-ANERA-300x300.jpg
Mochila Xtech De Transporte Xtb210,Tecnología,$16.50,https://timecenter.ec/wp-content/uploads/2019/06/340-300x300.png
"Candado, Cable De Seguridad Klip Xtreme Con Llave Y Clave Ksd-335","Accesorio de Computación, Cables, Candados de Seguridad",$16.40,https://timecenter.ec/wp-content/uploads/2019/08/Klip-Xtreme-KSD-335-300x300.jpg
"Combo Teclado+ Mouse USB, Stylish Slim c130","Mouse, Teclado",$16.40,https://timecenter.ec/wp-content/uploads/2019/02/Teclado-y-Mouse-Genius-inalambrico-300x300.jpg
"Ventilador, Base de enfriamiento Anera para Laptop , SY-C5","Tecnología, Ventiladores",$16.25,https://timecenter.ec/wp-content/uploads/2018/09/Ventilador--300x300.jpg
Reloj Casio Analógico Para Mujer LQ-139AMV-1,Casio Analógico,$16.00,https://timecenter.ec/wp-content/uploads/2021/05/RELOJ-CASIO-7-1-300x300.jpg
Reloj Casio Analógico Para Mujer LQ-139BMV-7E,Casio Analógico,$16.00,https://timecenter.ec/wp-content/uploads/2018/05/Reloj-Casio-Dama-LQ-139B-7E-300x300.jpg
Reloj Casio Analógico Para Mujer LQ-139AMV-7B3,Casio Analógico,$16.00,https://timecenter.ec/wp-content/uploads/2021/05/RELOJ-CASIO-lQ-139-1-300x300.jpg
Reloj Casio Analógico Para Mujer LQ-139EMV-1A,Casio Analógico,$16.00,https://timecenter.ec/wp-content/uploads/2018/05/Reloj-Casio-Dama-LQ-139E-1A-300x300.jpg
"Cargador Samsung De Pared Tipo C Con Cable Usb, 15w",Cables,$16.00,https://timecenter.ec/wp-content/uploads/2020/06/SAMSUNG-V3-300x300.jpg
Guias para Cortadora Profesional Wahl Set 6 Unidades,Para Detalles,$16.00$19.00,https://timecenter.ec/wp-content/uploads/2020/06/wahl_3168500-1-300x300.jpg
Cepillo Térmico Olivia Garden Nanothermic Nt64,"Cepillos, Salud y Belleza",$16.00,https://timecenter.ec/wp-content/uploads/2019/09/15-1-300x300.jpg
Radio Reloj Digital Supersonic,Radios,$16.00,https://timecenter.ec/wp-content/uploads/2018/07/Radio-Reloj-Supersonic-300x300.jpg
Reloj Casio Despertador PQ-30,Despertador,$16.00,https://timecenter.ec/wp-content/uploads/2018/02/RELOJ-CASIO-PQ-30-8-300x300.jpg
Cartucho De Tinta HP 667 Negro,Cartuchos- Tintas,$15.99,https://timecenter.ec/wp-content/uploads/2020/10/HP-4-1-300x300.jpg
Cartucho De Tinta HP 667 Tricolor,Cartuchos- Tintas,$15.99,https://timecenter.ec/wp-content/uploads/2020/10/HP-3-300x300.jpg
"Cartucho De Tinta HP 662, Negro",Cartuchos- Tintas,$15.99,https://timecenter.ec/wp-content/uploads/2020/06/HP-2-300x300.jpg
"Cartucho De Tinta HP 662, Tricolor",Cartuchos- Tintas,$15.99,https://timecenter.ec/wp-content/uploads/2019/09/HP-28-300x300.jpg
Cartucho De Tinta Colorido Hp 664 F6v28al,Cartuchos- Tintas,$15.99,https://timecenter.ec/wp-content/uploads/2019/06/664-COLOR-300x300.jpg
Cartucho De Tinta Negro Hp 664 F6v29al,Cartuchos- Tintas,$15.99,https://timecenter.ec/wp-content/uploads/2018/10/102-2-300x300.png
Calculadora Casio Científica FX-95ES PLUS-2,Calculadora,$15.75,https://timecenter.ec/wp-content/uploads/2020/03/FX-95ES-PLUS-2-300x300.jpg
Reloj Coby Despertador Cbc53grn,Despertador,$15.75,https://timecenter.ec/wp-content/uploads/2018/08/RELOJ-DESPERTADOR-COBY-CBC53GRN-300x300.png
Puntero Laser Usb Ae-LASERPU01,Puntero Laser,$15.75,https://timecenter.ec/wp-content/uploads/2018/05/2-1-300x300.jpg
"Bateria, Pilas, Recargable GP Tipo D",Pilas Recargables,$15.75,https://timecenter.ec/wp-content/uploads/2018/02/PILAS-GP-RECARGABLES-TIPO-D-300x300.jpg
Pilas Recargables GP Tipo C,Pilas Recargables,$15.75,https://timecenter.ec/wp-content/uploads/2018/02/PILAS-GP-RECARGABLES-TIPO-C-300x300.jpg
Calculadora Casio Científica FX-85ES PLUS-2,Calculadora,$15.65,https://timecenter.ec/wp-content/uploads/2020/03/FX-85ES-PLUS-2-300x300.jpg
"Ventilador, Base de enfriamiento Anera para Laptop , AE-CP315",Ventiladores,$15.50,https://timecenter.ec/wp-content/uploads/2020/11/kingtong-1-300x300.jpg
Cable Extension Usb Anera 10metros con Amplificación,"Cables, Tecnología",$15.50,https://timecenter.ec/wp-content/uploads/2018/07/CABLE-extencion-usb-300x300.jpg
"Candado, Cable De Seguridad Klip Xtreme Con Llave Ksd-330","Accesorio de Computación, Cables, Candados de Seguridad, Tecnología",$15.30,https://timecenter.ec/wp-content/uploads/2019/08/4-2-300x300.png
Cable De Carga Y Sync Plano Lightning 1.8m Blanco Changeworx,Sin categorizar,$15.25,https://timecenter.ec/wp-content/uploads/2018/09/pp-300x300.png
Micrófono Gaming Para PS USB marca Anera,Micrófono,$15.00,https://timecenter.ec/wp-content/uploads/2021/06/Microfono--300x300.jpg
Correa de Cuero Para Reloj,Correas para Reloj,$15.00,https://timecenter.ec/wp-content/uploads/2021/02/cuero-36-11-300x300.jpg
Correa de Cuero Para Reloj,Correas para Reloj,$15.00,https://timecenter.ec/wp-content/uploads/2021/02/cuero-36-10-300x300.jpg
Correa de Cuero Para Reloj,Correas para Reloj,$15.00,https://timecenter.ec/wp-content/uploads/2021/02/cuero-16-300x300.jpg
Correa de Cuero Para Reloj (copia),Correas para Reloj,$15.00,https://timecenter.ec/wp-content/uploads/2021/02/cuero-39-300x300.jpg
Correa de Cuero Para Reloj,Correas para Reloj,$15.00,https://timecenter.ec/wp-content/uploads/2021/02/cuero-36-3-300x300.jpg
Correa de Cuero Para Reloj,Correas para Reloj,$15.00,https://timecenter.ec/wp-content/uploads/2021/02/cuero-36-2-300x300.jpg
Correa de Cuero Para Reloj,Correas para Reloj,$15.00,https://timecenter.ec/wp-content/uploads/2021/02/cuero-36-1-300x300.jpg
Set de 6 Peinillas Babyliss Pro Nano Titanio,"Cepillos, Para Detalles",$15.00$22.00,https://timecenter.ec/wp-content/uploads/2020/06/Set-de-6-Peines-Babyliss-Profesionales-BABCOMBSET3-300x300.jpg
Espejo Babylisspro Irrompible Bes0557ucc,Para Detalles,$15.00,https://timecenter.ec/wp-content/uploads/2019/09/64-300x300.jpg
Reloj Q&Q Analógico Para Mujer Vq58j009y,QyQ Deportivo,$15.00,https://timecenter.ec/wp-content/uploads/2019/09/131-300x300.png
Reloj Q&Q Analógico Para Mujer Q151-305y,QyQ Formal,$15.00,https://timecenter.ec/wp-content/uploads/2019/09/129-300x300.png
Reloj Q&Q Analógico Para Mujer Vq58j010y,QyQ Deportivo,$15.00,https://timecenter.ec/wp-content/uploads/2019/09/81-300x300.png
Reloj Q&Q Analógico Para Mujer Vq58j006y,"Relojería, Relojes",$15.00,https://timecenter.ec/wp-content/uploads/2019/09/78-300x300.png
Reloj Q&Q Analógico Para Hombre Y Mujer Vq92j003y,QyQ Deportivo,$15.00,https://timecenter.ec/wp-content/uploads/2019/09/44-300x300.png
Reloj Q&Q Analógico Para Hombre Y Mujer Vq92j007y,QyQ Deportivo,$15.00,https://timecenter.ec/wp-content/uploads/2019/09/53-300x300.png
Reloj Q&Q Analógico Para Hombre Y Mujer Vq92j010y,QyQ Deportivo,$15.00,https://timecenter.ec/wp-content/uploads/2019/09/64-300x300.png
Reloj Q&Q Analógico Para Hombre Y Mujer Vr06j002y,QyQ Deportivo,$15.00,https://timecenter.ec/wp-content/uploads/2019/09/20-1-300x300.png
Reloj Q&Q Analógico Para Hombre Y Mujer VR06J008Y,QyQ Deportivo,$15.00,https://timecenter.ec/wp-content/uploads/2019/09/17-1-300x300.png
Reloj Q&Q Analógico Para Hombre Y Mujer Vr06j001y,QyQ Deportivo,$15.00,https://timecenter.ec/wp-content/uploads/2019/09/18-300x300.png
Reloj Q&Q Analógico Para Hombre Y Mujer Vr06j005y,QyQ Deportivo,$15.00,https://timecenter.ec/wp-content/uploads/2019/09/19-1-300x300.png
Set 4 Peines Guias para Cortadora Wahl Con Soporte Metálica,"Para Detalles, Salud y Belleza",$15.00,https://timecenter.ec/wp-content/uploads/2018/07/alsas-300x300.jpg
"Correas para reloj Fossil,Diesel, Guess, Casio",Correas para Reloj,$15.00,https://timecenter.ec/wp-content/uploads/2018/02/PULSERA-CUERO-18-300x300.jpg
"Correas para Reloj Fossil,Diesel, Guess, Casio",Correas para Reloj,$15.00,https://timecenter.ec/wp-content/uploads/2018/02/Correas-7-300x300.jpg
"Correas para reloj Fossil,Diesel, Guess, Casio",Correas para Reloj,$15.00,https://timecenter.ec/wp-content/uploads/2018/02/PULSERA-CUERO-5-300x300.jpg
"Correas para reloj Fossil,Diesel, Guess, Casio",Correas para Reloj,$15.00,https://timecenter.ec/wp-content/uploads/2018/02/PULSERA-CUERO-3-300x300.jpg
"Correas para reloj Fossil,Diesel, Guess, Casio",Correas para Reloj,$15.00,https://timecenter.ec/wp-content/uploads/2018/02/PULSERA-CUERO-2-300x300.jpg
Reloj Q&Q Analógico Para Mujer VQ94J0,QyQ Deportivo,$15.00,https://timecenter.ec/wp-content/uploads/2018/01/Reloj-QyQ-VQ94J014Y-300x300.jpg
"Mouse Ergonómico, Anera, para Zurdo, inalambrico  USB AE-MCV10",Mouse,$14.85,https://timecenter.ec/wp-content/uploads/2019/02/Mouse-ergonomico-Anera-AE-MCV09-2-300x300.jpg
Mouse Ergonomico Diseño Vertical AE-MRV08,"Mouse, Tecnología",$14.85,https://timecenter.ec/wp-content/uploads/2018/09/Mouse-ergonomico-Anera-AE-MCV06n-300x300.jpg
"Mouse Ergonómico,Diseño Vertical, Anera, AE-MRV02","Mouse, Tecnología",$14.85,https://timecenter.ec/wp-content/uploads/2018/02/Mouse-ergonomico-Anera-AE-MRV02-300x300.jpg
Peine de Pulgas Wahl 2 en 1 para Mascota,Máquinas Para Mascota,$14.75,https://timecenter.ec/wp-content/uploads/2021/06/9-4-3-300x300.jpg
"Parlantes Xtech estéreo multimedia de 2.0 canales, luces led, Incendo, XTS-130",Parlantes,$14.75,https://timecenter.ec/wp-content/uploads/2021/02/XTECH-300x300.jpg
Teclado Klip Xtreme Numérico Inalámbrico Knp-110,"Teclado, Tecnología",$14.75,https://timecenter.ec/wp-content/uploads/2019/08/27-300x300.png
Regulador Automático de Voltaje Forza FVR-1001,Reguladores de Voltaje,$14.50,https://timecenter.ec/wp-content/uploads/2021/01/Sin-titulo-7-300x300.jpg
Kit Filtros Eletrolux para Aspiradora Ergorápido Erg21 al Erg25,Filtros Aspiradoras,$14.50,https://timecenter.ec/wp-content/uploads/2020/07/EF144-300x300.jpg
Combo Teclado y Mouse XTECH XTK-301S,Teclado,$14.50,https://timecenter.ec/wp-content/uploads/2020/07/XTK-301S-300x300.jpg
Babyliss Mascarilla Reparadora Y Humectante Aceite De Argán,"Productos con Aceite de Argan, Salud y Belleza",$14.50,https://timecenter.ec/wp-content/uploads/2018/05/BCOMBSET3-1-1-300x300.jpg
Babyliss Shampoo Reparador Con Aceite De Argán,"Productos con Aceite de Argan, Salud y Belleza",$14.50,https://timecenter.ec/wp-content/uploads/2018/05/AOILC12-1-300x300.jpg
"Acondicionador Babyliss Pro Argan,Pro Baoilc12 350ml 12 Oz","Productos con Aceite de Argan, Salud y Belleza",$14.50,https://timecenter.ec/wp-content/uploads/2018/05/Acondicionador-Argan-Babyliss-Pro-Baoilc12-350ml-12-Oz-300x300.jpg
Aceite De Argán Babyliss Tratamiento para Planchado AOIL3,"Productos con Aceite de Argan, Salud y Belleza",$14.25,https://timecenter.ec/wp-content/uploads/2018/05/Aceite-de-Argan-300x300.png
Mouse Inalambrico Logitech Optico Azul,Mouse,$14.00,https://timecenter.ec/wp-content/uploads/2020/06/M170-AZUL-300x300.jpg
Mouse Inalambrico Logitech Optico Negro,Mouse,$14.00,https://timecenter.ec/wp-content/uploads/2020/06/M170-NEGRO-300x300.jpg
"Teléfono Uniden Alámbrico As7413, Con Altavoz","Hogar, Teléfono",$14.00,https://timecenter.ec/wp-content/uploads/2019/08/7-4-300x300.png
Mouse Inalambrico Logitech Optico Rojo Para Pc Notebook,Mouse,$14.00,https://timecenter.ec/wp-content/uploads/2019/02/Mouse-Inalambrico-Ligitech-M170-t-300x300.jpg
Calculadora Científica Casio FX-350LA PLUS-2M,Calculadora,$14.00,https://timecenter.ec/wp-content/uploads/2018/01/CASIO-42-300x300.jpg
"Radio de bolsillo Coby, am-fm, altavoz",Radios,$13.95,https://timecenter.ec/wp-content/uploads/2018/02/RADIO-COBY-300x300.png
"Parlante Bluetooth Coby,",Bluetooth,$13.95,https://timecenter.ec/wp-content/uploads/2018/02/Parlante-Coby-CSBT-333BK-300x300.jpg
Control Remoto Universal Con Botones Grandes Sony Rmez4bc2,"Control Remoto, Tecnología",$13.90,https://timecenter.ec/wp-content/uploads/2018/09/LOGO-CORREGIDO-19-300x300.png
Calculadora Científica Casio FX-82LA PLUS-2,Calculadora,$13.85$15.50,https://timecenter.ec/wp-content/uploads/2021/09/fx-82LA-PLUS-2-1-300x300.jpg
Calculadora Científica Casio FX-82LA PLUS,Calculadora,$13.85$15.50,https://timecenter.ec/wp-content/uploads/2020/03/fx-82LA-PLUS-2-300x300.jpg
Calculadora Científica Casio FX-82LA PLUS-2M,Calculadora,$13.85$15.50,https://timecenter.ec/wp-content/uploads/2020/03/fx-82LA-PLUS-2-2-300x300.jpg
Calculadora Casio De Mesa Mc-12m,Calculadora,$13.80,https://timecenter.ec/wp-content/uploads/2019/04/672-1-300x300.png
Flash Memory Kingston DTIG4/64GB,"Memorias, Tecnología",$13.60,https://timecenter.ec/wp-content/uploads/2020/06/DTIG464GB1-300x300.jpg
Micrófono Sony Dinámico F-V100,"Audio y Video, Micrófono, Tecnología",$13.50,https://timecenter.ec/wp-content/uploads/2019/10/F-V100-300x300.jpg
"Ventilador, Base de enfriamiento Anera para Laptop , AE-CP227","Tecnología, Ventiladores",$13.50,https://timecenter.ec/wp-content/uploads/2018/09/ventilador-300x300.jpg
"Batería, Pilas, Panasonic Para Teléfonos Inalámbricos, AAA","Baterías para Teléfonos, Pilas Recargables",$13.50,https://timecenter.ec/wp-content/uploads/2018/02/Batería-para-Teléfono-Panasonic-HHR-55AAAB-300x300.jpg
Cepillo Térmico Olivia Garden Nanothermic Nt54,"Cepillos, Salud y Belleza",$13.40,https://timecenter.ec/wp-content/uploads/2019/09/13-1-300x300.jpg
Micrófono Condensador para Laptop PC Entrada 3.5mm Incluye Soporte,Micrófono,$13.00,https://timecenter.ec/wp-content/uploads/2021/06/Microfono-2-300x300.jpg
Guías Peines para Cortadora Profesional Babyliss Pro,Para Detalles,$13.00,https://timecenter.ec/wp-content/uploads/2020/09/fxcs880-babylisspro-black-combset-main-300x300.jpg
Teclado Numerico con cable USB klipxtreme,"Teclado, Tecnología",$13.00,https://timecenter.ec/wp-content/uploads/2020/06/KBK-510-land-1-1-1-300x300.jpg
Pilas Recargables GP AA X4,Pilas Recargables,$12.95,https://timecenter.ec/wp-content/uploads/2018/02/GP-270AAHCE-300x300.jpg
Accesorio Para Licuadora Oster Vaso para Mesclar y llevar BLSTAG9630R-011,Cocina,$12.90,https://timecenter.ec/wp-content/uploads/2021/01/OLLA-PRIMA-9-LITROS-NEGRO-8-5-300x300.jpg
"Radio Reloj Despertador, Am/fm Emerson Cks1800",Radios,$12.85,https://timecenter.ec/wp-content/uploads/2019/08/3-5-300x300.png
"Cable USB, Carga, Datos, Para Celular Metalizado Chargeworx",Cables,$12.80,https://timecenter.ec/wp-content/uploads/2019/02/90-300x300.png
Memoria Micro Sd Kingston 64gb Class10 Sdcs/64gb,"Memorias, Tecnología",$12.75,https://timecenter.ec/wp-content/uploads/2018/10/242-300x300.png
Cargador de Pilas Recargables Energizer Mini,Cargadores de pilas,$12.75,https://timecenter.ec/wp-content/uploads/2018/02/CARGADOR-ENERGI-300x300.jpg
Pilas Recargables Energizer Tipo C,Pilas Recargables,$12.60,https://timecenter.ec/wp-content/uploads/2018/02/BATERIA-TIPO-C-300x300.jpg
Pilas Recargables Energizer Tipo D,Pilas Recargables,$12.60,https://timecenter.ec/wp-content/uploads/2018/02/BATERIA-TIPO-D-300x300.jpg
Calculadora Casio Científica  FX-350MS-2,Calculadora,$12.50,https://timecenter.ec/wp-content/uploads/2020/03/FX-350MS-2-300x300.jpg
Reloj Casio Despertador TQ-141,Despertador,$12.50,https://timecenter.ec/wp-content/uploads/2018/02/RELOJ-CASIO-DESPERTADOR-T-1-300x300.jpg
Micrófono Philips Con Cable Para Karaoke Sbcmd11000,"Audio y Video, Micrófono, Tecnología",$12.25,https://timecenter.ec/wp-content/uploads/2019/10/6-300x300.png
"Wahl Cortador Femenino Para Cejas, Vello Facial Bikini","Depilador Femenina, Salud y Belleza",$12.15,https://timecenter.ec/wp-content/uploads/2018/06/Cortadora-Wahl-09865-100-para-dama-b-300x300.jpg
Cepillo De Pelo Wahl Para Mascotas con doble cara Mediano,Máquinas Para Mascota,$12.00,https://timecenter.ec/wp-content/uploads/2021/06/9-4-300x300.jpg
Correa de Cuero Sintético Diloy Para Reloj,Correas para Reloj,$12.00,https://timecenter.ec/wp-content/uploads/2021/02/cuero-36-15-300x300.jpg
Lubricante Enfriador Profesional Wahl en Spray Desinfectante para cortadora de cabello,Para Detalles,$12.00,https://timecenter.ec/wp-content/uploads/2020/12/Cortadora-Wahl-Combo-5-300x300.jpg
Correa de Cuero Sintético Diloy Para Reloj,Correas para Reloj,$12.00,https://timecenter.ec/wp-content/uploads/2020/11/cuero-36-16-300x300.jpg
Correa de Cuero Sintético Diloy Para Reloj,Correas para Reloj,$12.00,https://timecenter.ec/wp-content/uploads/2020/11/Diloy-azul-300x300.jpg
Correa de Cuero Sintético Diloy Para Reloj,Correas para Reloj,$12.00,https://timecenter.ec/wp-content/uploads/2020/11/Diloy-negro-300x300.jpg
"Wahl, afeitadora rasuradora para Nariz,Oído y Cejas","Para Detalles, Salud y Belleza",$12.00,https://timecenter.ec/wp-content/uploads/2018/04/Cortadora-Nasal-Combo-05560-3308-300x300.jpg
Palanca Control Omega Juegos Ejes 12 Botones Usb,Tecnología,$12.00,https://timecenter.ec/wp-content/uploads/2018/03/PALANMC-OMEGA-300x300.jpg
Audífono JBL Harman TUNE 110 Pure Bass,Audífonos,$11.99$15.00,https://timecenter.ec/wp-content/uploads/2020/10/JBL-T110BTC-300x300.jpg
Teléfono Alámbrico Uniden  Identificaor de llamadas As7104,"Tecnología, Teléfono",$11.95,https://timecenter.ec/wp-content/uploads/2019/01/1-3-300x300.png
Cepillo Térmico Olivia Garden Nanothermic Nt-44,"Cepillos, Salud y Belleza",$11.90,https://timecenter.ec/wp-content/uploads/2019/09/1-1-300x300.jpg
Cortaúñas Wahl  para Mascota Pequeño Curvo,Máquinas Para Mascota,$11.85,https://timecenter.ec/wp-content/uploads/2021/06/cortaunas--300x300.jpg
"Parlantes Xtech estéreo multimedia de 2.0 canales con alimentación USB y cable de 3,5mm",Parlantes,$11.75,https://timecenter.ec/wp-content/uploads/2021/02/XTECH-1-300x300.jpg
Calculadora Casio Científica  FX-82MS,Calculadora,$11.70,https://timecenter.ec/wp-content/uploads/2018/01/684-300x300.png
"HUB USB 3.O Anera, 4 Puertos, H404",Cables,$11.50,https://timecenter.ec/wp-content/uploads/2021/05/HUB-1-300x300.jpg
"Mouse USB Gaming (Juegos) XTM-510, Tres colores de luces, 2400dpi",Mouse,$11.50,https://timecenter.ec/wp-content/uploads/2020/11/PLANTILLA-11-300x300.jpg
Kit de filtros Electrolux para aspiradora EAS30 – EAS31,Filtros Aspiradoras,$11.50,https://timecenter.ec/wp-content/uploads/2020/08/FAS30-300x300.jpg
Kit de Filtros Electrolux para aspiradora ABS02,Filtros Aspiradoras,$11.50,https://timecenter.ec/wp-content/uploads/2020/08/EFS01--300x300.jpg
Kit de Filtros Electrolux para Aspiradora SON10 Electrolux,Filtros Aspiradoras,$11.50,https://timecenter.ec/wp-content/uploads/2020/08/FSO01-300x300.jpg
Kit de filtros Electrolux para aspiradoras Ergorápido – ERG26 y ERG27 Electrolux,Filtros Aspiradoras,$11.50,https://timecenter.ec/wp-content/uploads/2020/08/FEE20-300x300.jpg
Kit Filtros Electrolux para Aspiradora  Ergorápido – ERG10 a ERG25,Filtros Aspiradoras,$11.50,https://timecenter.ec/wp-content/uploads/2020/08/FEE10-a-300x300.jpg
Cepillo Olivia Garden Nanothermic Nts9r,"Cepillos, Salud y Belleza",$11.50,https://timecenter.ec/wp-content/uploads/2019/09/56-300x300.jpg
Cautin Profesional 110v-120v 25w 50b125,Electrónica,$11.50,https://timecenter.ec/wp-content/uploads/2019/03/380-1-300x300.png
Alicate Profesional Cutícula 9mm,"Cuidado de manos y pies, Salud y Belleza",$11.50,https://timecenter.ec/wp-content/uploads/2019/02/Aceite-Wahl-300x300.jpg
Cargador de Pilas Recargables GP,Cargadores de pilas,$11.50,https://timecenter.ec/wp-content/uploads/2018/02/CARGADOR-GP-2-PILAS-2100mAh-300x300.jpg
Cepillo Pequeño De Pelo Wahl Para Mascotas con doble cara,Máquinas Para Mascota,$11.00,https://timecenter.ec/wp-content/uploads/2021/06/9-4-2-300x300.jpg
Cepillo Térmico Olivia Garden Ceramic+ion Ci45,"Cepillos, Salud y Belleza",$11.00,https://timecenter.ec/wp-content/uploads/2019/09/39-300x300.jpg
Cautin Para Estación De Soldar,Electrónica,$11.00,https://timecenter.ec/wp-content/uploads/2019/03/406-1-300x300.png
"Mouse Inalambrico KLIP Xtreme KMW-400, Modelo silencioso",Mouse,$11.00,https://timecenter.ec/wp-content/uploads/2019/02/Mouse-Inalambrico-Plip-Xtreme-300x300.jpg
